שם,מספר כתבה,כותרת,צפיות,תאריך יצירה
רוי שיינמן,1083053,"אילון מאסק מתרסק בארה""ב - המכירות של טסלה בשפל",858,08/09/2025 14:14
יהודה רוזן,1082968,"חדשות 12 תחת מתקפה של משפחת חטופים: ""בחרו למחוק משפחות בגלל דעה""",1919,08/09/2025 14:04
צוף צימרינג,1083051,"מירן בוזגלו בדרמה: ""אין לי אוויר""",291,08/09/2025 13:57
צוף צימרינג,1083018,"יעל בר זוהר: ""אין לי מילים, מציאות הזויה""",263,08/09/2025 13:31
יהודה לוינגר,1083049,"נתניהו: ""ננקוט בצעדים הקשים ביותר"", הותרו לפרסום שמות הנרצחים בפיגוע",617,08/09/2025 13:30
איציק יצחקי,1083050,למרות המבצע בעזה - זה מה שקרה לגירעון בחודש אוגוסט,372,08/09/2025 13:28
כפיר אדר,1083019,רמי לוי יגיב? זו הרשת שרוצה לשבור את השוק בחגים,653,08/09/2025 13:21
אפרת קרסנר,1083048,אירוויזיון 2026: ספרד בהצהרה דרמטית על ישראל ,448,08/09/2025 13:19
רעי שני,1083047,"בן כספית עוקץ את נתניהו: ""הרי פיגועים לא היו כאן אף פעם""",752,08/09/2025 13:17
צוף צימרינג,1083044,אסי כהן ובכירה בחדשות כאן 11 בזוגיות? זו התשובה,1334,08/09/2025 13:11
ענת סימן טוב,1083028,לקראת החגים: מדוע עוגות הדבש מתייקרות ומה המחיר?,373,08/09/2025 13:10
רוי שיינמן,1083020,הביטקוין ממשיך לטפס: איזו מדינה מחזיקה הכי הרבה מטבעות?,475,08/09/2025 13:03
אפרת קרסנר,1083046,אביב גופן דוחה הכל: זה הצעד בעקבות הפיגוע בירושלים,284,08/09/2025 13:01
כפיר אדר,1083010,בתו של דן מרגלית מתאוששת ממותו: ''גופך התעייף אך נותר צלול'',700,08/09/2025 12:57
הדר הראל,1083032,מחקר של 40 שנה מגלה: זה המפתח למראה צעיר ואריכות ימים,416,08/09/2025 12:57
כפיר אדר,1083037,רשות המסים עלתה על איש העסקים: כך העלים 18.25 מיליון שקל,607,08/09/2025 12:47
צוף צימרינג,1083043,"יוסף חדאד: ""הלב שבור, רותח מזעם!""",433,08/09/2025 12:39
רעי שני,1083038,אברך מסתער ומחסל את המחבלים: התיעוד הדרמטי מהפיגוע בירושלים,1414,08/09/2025 12:26
צוף צימרינג,1083041,"דניאל עמית מגיבה לדרמה: ""כל הקללות שבעולם""",443,08/09/2025 12:26
אפרת קרסנר,1083042,"אייל גולן נשבר: ""הנפש לא יודעת להכיל את הכאב, הנשמה זועקת""",12262,08/09/2025 12:22
רעי שני,1083016,מהפכה בתחבורה הציבורית בישראל: עסקת ענק בשווי 750 מיליון שקל,515,08/09/2025 12:06
צוף צימרינג,1083033,"שניר בורגיל: ""אני לא יכול להישאר אדיש, הלב שלי""",291,08/09/2025 12:05
אפרת קרסנר,1083036,ערוצי הטלוויזיה מודיעים על שינויים בלוח השידורים: זו התוכנית שתבוטל הערב,652,08/09/2025 12:03
רוי שיינמן,1083035,הדולר נופל לשפל של חודשיים - בכמה הוא נסחר כעת?,764,08/09/2025 12:01
כפיר אדר,1083012,הסוף למענק המפנק מביטוח לאומי: בית המשפט בהחלטה דרמטית ,20614,08/09/2025 11:56
כפיר אדר,1083008,אברי גלעד נכנס בחיילי צה''ל בזעם: ''אל תהיו חמורים'',388,08/09/2025 11:54
רפאל בן זקרי,1083034,רובוט למשימות מסוכנות: זה הפיתוח שכולם יוכלו לרכוש לבית בקרוב?,336,08/09/2025 11:52
רוי שיינמן,1083029,"מנכ""ל ענקית הרכבים חושף: ""הפסדנו מיליארדים""",446,08/09/2025 11:45
אפרת קרסנר,1083030,"מעיין אדם מגיבה לבשורות הקשות: ""בוקר שחור""",495,08/09/2025 11:45
צוף צימרינג,1083031,"אופירה אסייג מתרסקת: ""המון כאב""",940,08/09/2025 11:39
צוף צימרינג,1083027,"אייל גולן ודניאל גרינברג מבלים יחד: ""היא נכנסה ללופ"" | צפו",1093,08/09/2025 11:23
ענת סימן טוב,1083007, בהשקעה של 1.5 מיליון שקל: סניף חדש לרשת האופנה,300,08/09/2025 11:15
אפרת קרסנר,1083024,"""שישי הפוך יותר"" בהישג ענק בקופות: עקף את סרט הקאלט המצליח",293,08/09/2025 11:13
הדר הראל,1083017,הסוד לפסטה מושלמת: 5 טעויות שאתם עושים בבישול הפסטה,511,08/09/2025 10:56
צוף צימרינג,1083026,מאות אלפי עוקבים בשוק: זה הצעד המפתיע ,0,08/09/2025 10:56
צוף צימרינג,1083021,"כוכבת ""האח הגדול"" התארסה: זה הגבר בחייה",262,08/09/2025 10:54
איציק יצחקי,1083022,"האיש החזק בשוק הנדל""ן במתקפה: ""שר האוצר לא מחובר""",848,08/09/2025 10:49
אפרת קרסנר,1083014,טקס פרסי MTV האמריקאי: זו כוכבת הפופ שגרפה הכי הרבה פסלונים,232,08/09/2025 10:37
רעי שני,1083015,"פיגוע ירי קשה בירושלים: 6 נרצחים, למעלה מ-20 פצועים",2757,08/09/2025 10:26
כפיר אדר,1082999,מהפכה בתעודות הזהות בישראל: הסוף לשימוש בתאריך ההנפקה?,263,08/09/2025 10:18
הדר הראל,1082903,לא מצליחים להתחיל משימות? החוקים שישנו לכם את החיים,738,08/09/2025 10:18
כפיר אדר,1083013,אל על בבשורה אדירה לנוסעים: כך תטוסו בזול עד ה-30.9,914,08/09/2025 10:18
רוי שיינמן,1082901,OpenAI מזהירה: התחזית המדאיגה לגבי הבינה המלאכותית,764,08/09/2025 10:12
רעי שני,1083011,הרכב הקטן בעולם נוחת בישראל: המחיר הנמוך והפתרון לבעיות החניה,4243,08/09/2025 10:11
רפאל בן זקרי,1082990, OpenAI מודה: זו הסיבה ש-ChatGPT טועה והוזה?,584,08/09/2025 09:59
אפרת קרסנר,1083004,"כתב ערוץ 13 חוגג יום מרגש: ""אהובי החתיך""",368,08/09/2025 09:51
כפיר אדר,1082986,האקסית של בן אל תבורי נחשפת: ''מרגיש שם לא רצוי'',310,08/09/2025 09:45
איציק יצחקי,1083001,גינדי החזירה כ-80 מיליון שקל לרוכשי הדירות בשדה דב,4333,08/09/2025 09:41
כפיר אדר,1082998,אבל כבד בפוליטיקה הישראלית: איש הליכוד נפטר בגיל 64,2796,08/09/2025 09:37
כפיר אדר,1083002,רייטינג: האח הגדול שועט לגמרי וקשת 12 נותרה מבולבלת,1638,08/09/2025 09:36
רעי שני,1083005,רכבת ישראל עושה שינוי קיצוני בתנועה: מה יקרה בגלל עידן עמדי?,543,08/09/2025 09:34
כפיר אדר,1082995,הטייס בווידוי מטורף: מדוע כיבה את המנועים באמצע הטיסה?,932,08/09/2025 09:14
רעי שני,1082992,ברגר קינג סגרה בישראל: זו הרשת המפתיעה שתיפתח במקומה,1319,08/09/2025 09:13
רפאל בן זקרי,1082989, לא רק אייפון 17: אלו המוצרים המפתיעים שאפל תחשוף מחר,2189,08/09/2025 09:11
כפיר אדר,1082994,משה פרץ והמשפחה גוזרים קופון: הקמפיין ב-1.5 מיליון שקל נחשף,639,08/09/2025 08:57
רעי שני,1082993,קניון רמת אביב מתחדש: מותג האופנה של עשירי ישראל נפתח לראשונה,741,08/09/2025 08:50
אפרת קרסנר,1082997,ברקע ההאשמות על תקיפות מיניות: הכוכב ההוליוודי יופיע בתל אביב,287,08/09/2025 08:50
ענת סימן טוב,1082996, בשורה משמחת לטסים: זו חברת התעופה שחוזרת היום לישראל  ,471,08/09/2025 08:36
רוי שיינמן,1082908,הנתונים נחשפים: ההשקעות בחברות ההייטק חוזרות לישראל?,452,08/09/2025 08:24
כפיר אדר,1082982,השוק השחור של הדירות בישראל: כך השוכרים שעוזבים עושים רווח,509,08/09/2025 08:09
כפיר אדר,1082988,טיב טעם במהלך ענק: למי תרמה הרשת 105 אלף שקלים? ,542,08/09/2025 08:06
רפאל בן זקרי,1082983,מיקרוסופט התגברה על התקלה: התעלומה בים האדום נפתרה?,472,08/09/2025 08:03
רעי שני,1082987,למרות האיומים של בן גביר: שוטר נורה למוות במהלך מרדף,460,08/09/2025 07:57
רעי שני,1082985,שטראוס פותחת בתחרות עם תנובה על המוצר האהוב: יביא לירידת מחירים?,926,08/09/2025 07:44
רוי שיינמן,1082984,לקראת פתיחת המסחר: מה צפוי בבורסה ומה קורה באסיה?,583,08/09/2025 07:32
כפיר אדר,1082979,ספיר בורגיל מפתיעה אחרי הפרידה מאברהם אקלום: ''מרגישה אותה בבטן'',2683,08/09/2025 07:00
רעי שני,1082889,הכלכלן הבכיר: המשקיעים בורחים מישראל ומכרו מניות במיליארדים,826,08/09/2025 07:00
כפיר אדר,1082980,הבנקים בישראל מקבלים הוראות חדשות: הסוף לעוקץ על חשבונכם?,1315,08/09/2025 07:00
ענת סימן טוב,1082912," אושר עד, יש חסד או נטו חיסכון? זו רשת המזון החרדית הזולה ביותר  ",777,08/09/2025 06:45
רעי שני,1082814,"בנק מזרחי טפחות: הישראלים נוהרים לחו""ל, מחירי הטיסות נוסקים",352,08/09/2025 06:20
רפאל בן זקרי,1082960, נינטנדו מנצחת בענק: זה האיש שישלם לה מיליוני דולרים,343,08/09/2025 06:20
כפיר אדר,1082978,ביטוח לאומי בהודעה משמחת: זה המענק שתקבלו כבר ב-17.9,13728,08/09/2025 06:20
כפיר אדר,1082977,מגישת חדשות 12 נפרדת מישראל: ''לו''ז עמוס ומעט זמן'',1972,08/09/2025 06:12
רפאל בן זקרי,1082959, סמסונג חושפת בטעות? כך נראה הגלקסי שכולל שלושה מסכים,407,08/09/2025 06:02
איציק יצחקי,1082828,"מבצעי הקבלנים בשיא: ""חצי מיליון הנחה"", ""כנסו עכשיו, שלמו אחר כך""",765,08/09/2025 06:01
אפרת קרסנר,1082955,20 אמנים יופיעו בטקס הזיכרון ל-7.10 של המשפחות: זו הרשימה המלאה,523,08/09/2025 06:01
כפיר אדר,1082976,משרד הבריאות באזהרה חמורה: ''יש לפנות לחדר מיון בבית חולים'',1292,08/09/2025 06:01
כפיר אדר,1082975,"שדרוג השכר ב-12% .ומענקים עד 2,500 שקל: אלו העובדים שירוויחו",478,08/09/2025 05:46
כפיר אדר,1082974,השכר הגבוה בישראל נחשף: איפה תרוויחו הרבה יותר מכולם?,840,08/09/2025 05:37
רויטל ונונו,1082973,"דיירת האח הגדול חושפת: ""ברחתי מהבית""",450,08/09/2025 04:01
רויטל ונונו,1082972,"פאולה רוזנברג מגיבה למבקרים בסרטון ריקוד: ""כנסו, כנסו""",298,08/09/2025 03:35
יהודה רוזן,1082971,רמי לוי יפסיד את קו התעופה הבלעדי? הצעד שיקשה על ישראייר לפעול,898,08/09/2025 03:28
רויטל ונונו,1082970,200 שקל לא מספיקים לכיסוי מנה? זה מה שמביאים לחתונה חרדית,331,08/09/2025 03:02
יהודה רוזן,1082969,בתוכנית ה'פטריוטים' בשידור חי: הפאנליסטית קמה ועזבה - וזו הסיבה,779,08/09/2025 02:45
יהודה רוזן,1082967,מארק צוקרברג חשף סכום עתק - אך לא ידע שהוקלט | צפו במבוכה,360,08/09/2025 02:20
יהודה רוזן,1082966,"הכוכבת ההוליוודית משתלחת בישראל: ""רעב שנגרם מאכזריות""",375,08/09/2025 02:05
רויטל ונונו,1082965,"איתי לוי בתקרית אלימה: ""בספר תורה, אני כורת לו את היד""",7817,08/09/2025 01:57
יהודה רוזן,1082964,"החברה הישראלית היחידה שנכנסה להשקעה במנוע AI הפופולרי ""קלוד""",322,08/09/2025 01:41
יהודה רוזן,1082963,מנוי שידורי ספורט שמשנה את כללי המחיר הושק בישראל,1030,08/09/2025 01:30
רויטל ונונו,1082962,"שני אדרי חושפת את הצעד הבא שלה בקריירה: ""זו הייתה המטרה""",4210,08/09/2025 00:44
רויטל ונונו,1082961,"""ימעפנה"": דניאל עמית נגד הכתבת שקטלה את העוגה שלה",546,07/09/2025 23:59
ירון שמאי,1082958,"הקמפיין המפתיע שמחכה לחסידים באומן: מאות שלטי ""חזרה בשאלה""",894,07/09/2025 22:58
אפרת בבג'ני,1082957,קבוצת מר מגדילה את היקף ההכנסות לכ-363 מיליון שקל: זו הסיבה,393,07/09/2025 22:39
רפאל בן זקרי,1082933, מותג המסכים משיק בישראל: דגמים לעבודה משרדית עם פיצ’ר מפתיע,361,07/09/2025 22:29
ירון שמאי,1082956,היריב של בן גביר זוכה ב-18 אלף שקל: הרשימה היוקרתית נחשפת,496,07/09/2025 22:26
אפרת בבג'ני,1082954,"רמי לוי, יוחננוף או חצי חינם? זו המנצחת בסל הקניות הזול ביותר בחגים",685,07/09/2025 22:19
כפיר אדר,1082942,מהפכה בנקאית בדרך: כך ניר צוק מתכנן לשבור את השוק,2368,07/09/2025 22:08
יהודה רוזן,1082953,בשורה קשה לנהגים: ביום שישי הקרוב כדאי לכם להתרחק מהכבישים הללו,531,07/09/2025 21:46
אפרת קרסנר,1082949,אחרי כמעט עשור: העורך הוותיק ב-mako פורש - זה המינוי החדש והנוצץ באתר,489,07/09/2025 21:43
אפרת בבג'ני,1082952,"טראמפ בהצהרה דרמטית על עסקת החטופים: ""הישראלים קיבלו את התנאים""",503,07/09/2025 21:40
יהודה רוזן,1082951,דרמה ברמת גן: המטופל גילה את הרופא שרוע ללא רוח חיים,352,07/09/2025 21:39
כפיר אדר,1082914,מצלמות מהירות בישראל מושבתות: השיטה ההזויה נחשפת,309,07/09/2025 21:34
יהודה רוזן,1082950,"חנוך דאום נפרד: ""הייתה בינינו מערכת יחסים מאד חמה""",747,07/09/2025 21:32
אפרת בבג'ני,1082948,"שלקה בהלם ממחירי הדירות בתל אביב: ""אני לא מיליארדרית""",920,07/09/2025 21:30
יהודה רוזן,1082947,"אחרי 315 מלונות: כך פתאל מעביר את השרביט לדור הבא - ""למנוע כאוס""",337,07/09/2025 21:21
כפיר אדר,1082937,הפרוטקשן משתולל בישראל: כך רשות המסים מנסה לעצור זאת,530,07/09/2025 20:57
כפיר אדר,1082913,מכת שטרות 200 שקל מזויפים בישראל: כך נופלים בפח בקלות,11297,07/09/2025 20:56
רוי שיינמן,1082895,הכירו את המניות החדשות שנכנסו ל-S&P 500,1181,07/09/2025 20:46
אפרת בבג'ני,1082944,נס טכנולוגיות בעסקה: זו החברה שתרכוש לפי שווי של כ-60 מיליון שקל,435,07/09/2025 20:42
ירון שמאי,1082946,מיזוג ענק בעולם המשפט: זה יהיה משרד עורכי הדין הגדול בישראל,1074,07/09/2025 20:41
רפאל בן זקרי,1082945,"ה""נטפליקס של ה־AI"" מסתבך: כך נראה פרויקט השחזור השנוי במחלוקת",246,07/09/2025 20:29
כפיר אדר,1082943,ארקיע מתלוננת: ''אם נקבל אותם תנאים המחירים יהיו כמו בוויזאייר'',1349,07/09/2025 20:25
יהודה לוינגר,1082941,מסיבת יום ההולדת שאיחדה את אנשי העסקים וחברי הכנסת,995,07/09/2025 20:22
כפיר אדר,1082936,נתיבי איילון נחסמים לתנועה ליומיים: בשורה קשה לנהגים בישראל,368,07/09/2025 20:14
אפרת בבג'ני,1082938,ספיר בורגיל ואברהם אקלום בדרך לגירושים: מועד הדיון ברבנות נחשף,1326,07/09/2025 20:09
אפרת בבג'ני,1082940,"נאור ציון זוכה לפרגון ענק: ""אני חייב לו 90% מהקריירה שלי""",861,07/09/2025 20:08
כפיר אדר,1082922,בגיל 58: כוכב הפטריוטים שוב חוגג יום מאושר מתחת לחופה,1267,07/09/2025 20:02
כפיר אדר,1082902,רמי לוי מצהיר בשידור חי: ''אל תקנו יותר ממה שאתם צריכים'',1870,07/09/2025 20:00
רעי שני,1082896,"השחקנית האהובה חושפת: ""חטפתי מכות רצח על סט הצילומים""",531,07/09/2025 19:57
ירון שמאי,1082939,"ראש אמ""ן לשעבר: ""נתניהו ייחשב כאבי המדינה הפלסטינית""",532,07/09/2025 19:49
כפיר אדר,1082890,מחדשים תעודת זהות או דרכון? זה מה שעלול לסבך אתכם,421,07/09/2025 19:22
אפרת בבג'ני,1082935,"בחגי תשרי תיפרדו מכ-3,900 שקלים: כ-600 שקלים מתוכם ייזרקו לפח",351,07/09/2025 19:10
ירון שמאי,1082934,"המסעדה ברחוב הראשי נסגרת מיידית: ""חלודה ועובש, סכנה לזיהום""",562,07/09/2025 18:59
אפרת בבג'ני,1082932,נועה קירל חושפת הסכם סודיות: זה הצעד לפני החתונה עם דניאל פרץ,5883,07/09/2025 18:39
רפאל בן זקרי,1082925, בחזרה לעבר? המותג הזה השיק אוזניות חוטיות עם ביטול רעשים,248,07/09/2025 18:38
רוי שיינמן,1082872,"""הסקטור הזה יכול לעוף למעלה"": התחזית של האנליסט הבכיר",707,07/09/2025 18:37
כפיר אדר,1082907,ערוץ 14 מתקדם משרון גל: מי עומדים לקבל את המשבצת?,736,07/09/2025 18:25
אפרת בבג'ני,1082931,עומר אדם מתחזק בדת: זה הצעד המרגש של הזמר,931,07/09/2025 18:12
יהודה לוינגר,1082930,מחלבות גד נכנסת לבורסה: כמה תעלה לכם המניה החדשה? | כל הפרטים,1380,07/09/2025 18:00
ענת סימן טוב,1082919,"רמי לוי, יוחננוף או ויקטורי? זו רשת המזון הזולה ביותר  ",565,07/09/2025 17:54
אפרת בבג'ני,1082929,"אייל ברקוביץ' קובע בשידור חי: ""כל העולם שונא אותנו""",377,07/09/2025 17:53
כפיר אדר,1082885,הסוף להטבה מביטוח לאומי? עשרות אלפי ישראלים עשויים להפסיד,407,07/09/2025 17:48
כפיר אדר,1082892,מאי ערב בטענות נגד הפקת האח הגדול: ''לא שידרו את זה'',9154,07/09/2025 17:46
יונתן סידון,1082619,מהפכה או אשליה? בין הצלת האקלים לבריאות האדם,1901,07/09/2025 17:43
אפרת בבג'ני,1082927,"דרמה באילת: ""דקרו אותו וגרמו לו לחבלה חמורה ולסכנת חיים""",361,07/09/2025 17:32
איציק יצחקי,1082928,"הבכיר מבנק הפועלים מזהיר: ""זה מה שיקרה לריבית""",1855,07/09/2025 17:25
אפרת בבג'ני,1082926,"הבורסה בשיא חדש: ת""א 35 ות""א 125 מזנקים, אל על וישראייר חוגגות",823,07/09/2025 17:12
רפאל בן זקרי,1082911, אפל מקדימה את ההשקה ברגע האחרון: זה המוצר שתחשוף השבוע?,575,07/09/2025 17:06
כפיר אדר,1082883,שי לי עופרי בווידוי אחרי הגירושים: בדרך לחשוף זוגיות חדשה?,513,07/09/2025 17:02
צוף צימרינג,1082924,"ליקי רוזנברג תוקפת: ""מתפלח לעסק פרטי ומחרבן - זה לא סבבה!""",314,07/09/2025 16:49
אפרת בבג'ני,1082921,כוכבי ערוץ 14 נגד ניר דבורי: זו התבטאותו של כתב חדשות 12,8025,07/09/2025 16:37
צוף צימרינג,1082923,,0,07/09/2025 16:34
כפיר אדר,1082920,דבש מזויף נמכר בישראל: זה המותג שכדאי להיזהר ממנו,1921,07/09/2025 16:29
צוף צימרינג,1082918,"כוכבת ""האח הגדול"" חושפת: בן זוגי כוכב נטפליקס עבר לגור בישראל",395,07/09/2025 16:20
כפיר אדר,1082876,מהפכה בחניות בתל אביב: זה מה שיקרה מעכשיו,326,07/09/2025 16:16
כפיר אדר,1082853,אילנית לוי מדברת על מערכת יחסים פתוחה: ''לאלירז היה כואב בעצמות'' ,502,07/09/2025 16:12
רוי שיינמן,1082916,"הטיל פגע במשרד בת""א - והחברה מפטרת את העובדים בישראל",1469,07/09/2025 16:03
איציק יצחקי,1082530,כמה כסף אתם צריכים להרוויח כדי להיות בעשירון העליון?,1337,07/09/2025 16:03
אפרת בבג'ני,1082917,"קרן פלס: ""יש לי את הקטע המתנשא הזה כי אני מפורסמת""",253,07/09/2025 16:02
כפיר אדר,1082915,ארקיע מגיבה לפגיעה בנמל התעופה: הטיסות יופעלו מחדש?,333,07/09/2025 15:43
ענת סימן טוב,1082897,דניאל עמית לא לבד: הנה מחירי עוגות השוקולד של המתחרים,2844,07/09/2025 15:31
אפרת בבג'ני,1082910,"הקריפטו היומי: הביטקוין ממשיך לעלות, מגמה חיובית בשוק",354,07/09/2025 15:20
רפאל בן זקרי,1082909, שלושה מיליארד משתמשים: האם זו הטכנולוגיה שתפיל את חברות הסלולר?,542,07/09/2025 15:17
אפרת בבג'ני,1082906,"אברהם אקלום יודע? ספיר בורגיל: ""אני מאוד רוצה ילדים, זה יקרה""",597,07/09/2025 15:11
כפיר אדר,1082905,"פגיעה בנמל התעופה רמון: הכטב""ם החות'י גורם נזק כבד",1514,07/09/2025 15:04
צוף צימרינג,1082899,"יובל לוי נגד שני אדרי מ""האח הגדול"": ""אכלת סיבוב, הרגשות שלי לא זבל!""",3239,07/09/2025 15:00
איציק יצחקי,1082904,,0,07/09/2025 14:51
אפרת בבג'ני,1082900,מחקר חדש חושף: אלו שלושת המאכלים שתורמים לשיפור הזיכרון,712,07/09/2025 14:49
אפרת קרסנר,1082898,אירוויזיון 2026: מנהל רשות השידור האוסטרית מפרסם את החלטתו בנוגע לישראל,47466,07/09/2025 14:48
אפרת קרסנר,1082894,"כתבת חדשות 12 בבית חולים: ""מיון ילדים זה מקום מיוחד""",251,07/09/2025 14:30
כפיר אדר,1082882,ערוץ 14 והכתב הבכיר נתבעים: מי דורש מיליון שקל פיצוי?,790,07/09/2025 14:27
כפיר אדר,1082888,אבל בעולם התרבות: האיש מאחורי הסדרות האהובות בישראל נפטר,443,07/09/2025 14:26
יהודה לוינגר,1082893,"משה דבי במינוי מסקרן: הבכיר מוואלה שעזב ימונה לסמנכ""ל",467,07/09/2025 14:14
צוף צימרינג,1082891,"אמיר פרישר גוטמן ז""ל נגד בית חולים איכילוב: זה השינוי במשפטו",511,07/09/2025 14:14
כפיר אדר,1082847,ליאון רוזנברג מגיב להשפלה שחטף: ''הודעה מבחילה ואלימה'',1546,07/09/2025 14:07
רעי שני,1082886,"איילה חסון חושפת בכאב: ""מתעוררת בסיוטים בלילות""",491,07/09/2025 14:04
ענת סימן טוב,1082868,רמי לוי לא עוצר: היעד החדש אליו תגיע ישראייר ,496,07/09/2025 14:00
רוי שיינמן,1082858,דירוג המניות הביטחוניות באוגוסט: מי זינקה ב-25% ומי צללה ב-21%?,2079,07/09/2025 13:55
הדר הראל,1082887,מחקר חדש מזהיר: לישיבה בשירותים עם הסמארטפון יש מחיר כואב במיוחד,343,07/09/2025 13:52
רוי שיינמן,1082884,"רעידת אדמה בשוק הרכב: ""המכירות ייחתכו בחצי""",9957,07/09/2025 13:40
כפיר אדר,1082874,החברה הישראלית שקרסה מרוויחה בגדול: כמה תקבל מרשות המסים?,247,07/09/2025 13:39
יהודה לוינגר,1082864,תווי קנייה לחג: איפה תקבלו את ההנחה הגדולה ביותר?,406,07/09/2025 13:13
הדר הראל,1082879,מחקר חדש: התרופה בארון שלכם שעשויה לעצור קורונה,788,07/09/2025 13:13
ענת סימן טוב,1082877,פדיון רשתות המזון: מה קרה החודש ומי הרוויח?,237,07/09/2025 13:05
רעי שני,1082875,רומן אברמוביץ' מסתבך בגדול: נחקר בחשד לעבירות חמורות,678,07/09/2025 13:05
טל גורן,1082880,ניסתה להטביע את חמותה בים ונעצרה: הסיבה המוזרה נחשפת,529,07/09/2025 13:04
