שם,מספר כתבה,כותרת,צפיות,תאריך יצירה
רעי שני,1078545,עסקת מיליונים בתקשורת הישראלית: מי רוכש את האתר שמכר בחזרה?,712,08/08/2025 12:04
גיא מויאל,1078547,משתמשים בתרופה הזו? היא הפכה למסוכנת עבור רבים,2408,08/08/2025 12:03
דויד ויצמן,1078543,סופרמן בשירות טראמפ: השחקן שגילם את הגיבור יהפוך לסוכן ,356,08/08/2025 12:00
גיא מויאל,1078544,"הדרמות ב""האח הגדול"" לא הסתיימו: זה המסר ששלחו לאחד הדיירים",900,08/08/2025 11:47
אלמוג אמר,1078541,"בן כספית מפוצץ את הבלון: ""ארגוני טרור ג'יהאדיסטיים לא נכנעים""",904,08/08/2025 11:47
כפיר אדר,1078529,אחרי שנתיים של פרידה: קרן פלס ונועם טור מתאחדים,1261,08/08/2025 11:40
רעי שני,1078537,אייל שני נפרד: השף סוגר את המסעדה האהובה שלו אחרי 11 שנה,789,08/08/2025 11:37
גיא מויאל,1078542,שלמה קרעי במוקד: זה המכתב החריף ששוגר לשר התקשורת,458,08/08/2025 11:33
גיא מויאל,1078540,ערן זהבי יספר על הכל: מתי זה יקרה?,296,08/08/2025 11:21
דויד ויצמן,1078539,"מזעזע: הבעל חשד שהורעל, אשתו רצחה שלושה קרובים",0,08/08/2025 11:16
אלמוג אמר,1078535,"ט""ו באב: הקשר בין איינשטיין לסיפור האהבה בין עם ישראל והקב""ה",291,08/08/2025 11:15
גיא מויאל,1078536,"כוכב ""חתונה ממבט ראשון"" במסר לאקסית שעקצה: ""אז שתדע לתקן אותו""",500,08/08/2025 11:05
איציק יצחקי,1078157,"עסקאות השבוע בנדל""ן: היכן נמכרה דירה בת""א בפחות מ-2 מיליון שקל?",574,08/08/2025 11:03
דויד ויצמן,1078528,סיפוח עזה: בעולם מגיבים להחלטת הקבינט הביטחוני,570,08/08/2025 10:58
אלמוג אמר,1078533,"הקריפטו היומי: הביטקוין עלה, זה המטבע שזינק בכמעט 12%",364,08/08/2025 10:49
כפיר אדר,1078531,בגיל 75: השחקנית הישראלית האהובה מקבלת בשורה מרה,590,08/08/2025 10:47
כפיר אדר,1078521,כוכב מכבי ת''א לשעבר בסכנה: מדוע עלול להעצר בכל מדינה בעולם?,881,08/08/2025 10:47
כפיר אדר,1078504,אשתו של הרמטכ''ל לשעבר מודה: ''הבנתי שהוא לא חוזר'',268,08/08/2025 10:47
איציק יצחקי,1078486,עומר אדם מנפץ שיא: הסכום המטורף שירוויח מההופעות ברמת גן,21345,08/08/2025 10:46
גיא מויאל,1078532,"דניאל פרץ יחזור לישראל? ""הם לא רצו להרגיז אותם""",912,08/08/2025 10:44
רעי שני,1078530,"יצחק תשובה בעסקת 120 מיליארד שקל, אקזיט גדול בישראל ותדיראן מתרסקת",17628,08/08/2025 10:44
אלמוג אמר,1078523,"דיווח: טראמפ צעק על נתניהו - ""ילדים נראו רעבים מאוד"" ",341,08/08/2025 10:37
יהודה לוינגר,1078515,המדורג ראשון בעולם הניף את הגביע הנחשק - והמהפך בשחמט התחיל,496,08/08/2025 10:27
אפרת קרסנר,1078458,חדש על המסך: כל מה שחם ומעניין בטלוויזיה השבוע  ,329,08/08/2025 10:25
דויד ויצמן,1078519,"ארה""ב מיואשת: מכפילה את הפרס על הנשיא המבוקש ל-50 מיליון דולר",340,08/08/2025 10:25
אלמוג אמר,1078522,ראש בראש: שתי הגדולות בישראל במאבק על השחקן המבוקש בליגה,419,08/08/2025 10:01
רעי שני,1078514,האם יעזו לבלום את עסקת הענק? | מתן חודורוב,2746,08/08/2025 10:00
רעי שני,1078520,אקזיט נוסף בישראל: החברה שנמכרת ב-40 מיליון דולר לענקית התיירות,17539,08/08/2025 09:51
גיא מויאל,1078511,הזמר מהצמד לשעבר חושף: מה הוביל לסיום הקריירה המשותפת,477,08/08/2025 09:47
גיא מויאל,1078517,"רייטינג: גמר ""המטבח המנצח VIP"" העניק לקשת 12 את הניצחון הגדול",1101,08/08/2025 09:42
דויד ויצמן,1078512,בפעם השנייה ברציפות: המדינה החשובה באירופה מורידה את הריבית,291,08/08/2025 09:33
אלמוג אמר,1078516,מנסה ללחוץ את פאוול? טראמפ במינוי בכיר חדש ,261,08/08/2025 09:32
כפיר אדר,1078494,בני הזוג שחזרו משבי החמאס חוגגים יום מאושר: ''כמה חיכינו'',840,08/08/2025 09:29
כפיר אדר,1078510,"ינון מגל מזהיר מקריסת מדינת ישראל: ""נשארו שבועיים""",1331,08/08/2025 09:28
כפיר אדר,1078513,ראש הממשלה נתניהו מאיים בתביעת ענקית התקשורת: ''דיבה ברורה'',9609,08/08/2025 09:28
דויד ויצמן,1078506,רכבת שועטת נכנסה בוואן שנתקע על המסילה: התיעוד שמשגע את הרשת,399,08/08/2025 09:07
אלמוג אמר,1078509,"טראמפ, סגן הנשיא והשטן במיטה אחת: סאות' פארק עושה את זה שוב ",237,08/08/2025 09:04
רעי שני,1078507,אחרי האקזיט ב-25 מיליארד דולר: פאלו אלטו במהלך ראשון בישראל,489,08/08/2025 08:51
צוף צימרינג,1078370,"שי לי עופרי במתכון מתוק לסופ""ש | מה בתפריט?  ",466,08/08/2025 08:47
כפיר אדר,1078499,אחרי 19 שנה: כוכב רמזור בקאמבק שאף אחד לא ציפה,583,08/08/2025 08:44
כפיר אדר,1078500,"מודחת האח הגדול נגד ארז איסקוב: ''לבד, רווק וחסר תכלית''",1657,08/08/2025 08:43
גיא מויאל,1078508,"מסביר פיקוד העורף לשעבר תקף את הקבינט: ""אל תאשרו שום פעילות""",362,08/08/2025 08:40
אלמוג אמר,1078505,"ההכרה במדינה פלסטינית תעלה לה ביוקר? ""לבריטניה יש הרבה מה להפסיד"" ",493,08/08/2025 08:23
גיא מויאל,1078503,"אלימות קשה אחרי ההופעה של עדן בן זקן: ""ניסינו לעזור לו""",635,08/08/2025 08:13
אפרת קרסנר,1078454,"ליאור רז, אביב אלוש או תומר קאפון? זה השחקן הפופולרי בישראל",449,08/08/2025 08:06
דויד ויצמן,1078497,"חבר הכנסת החרדי פתח בשביתת רעב: ""אני לא הולך לאכול, לא אשתה""",415,08/08/2025 08:05
רעי שני,1078502,"ה-S&P 500 מזנק, הבורסה בתל אביב צוללת: זה מה שקרה השבוע במסחר",525,08/08/2025 08:00
גיא מויאל,1078501,"יאיר גולן: ״החלטת הקבינט בניגוד לדעת הרמטכ״ל היא אסון לדורות""",221,08/08/2025 07:51
אלמוג אמר,1078496,נסראללה מתהפך בקברו: ממשלת לבנון בהחלטה היסטורית,209,08/08/2025 07:51
כפיר אדר,1078495,הסטנדאפיסט האהוב למודחת הלוהטת מהאח הגדול: ''את הטעם שלי'',784,08/08/2025 07:43
אפרת קרסנר,1078462,"""שישי הפוך יותר"": מפתיע ומצחיק לא פחות מקודמו, ומתאים לכל המשפחה",420,08/08/2025 07:42
גיא מויאל,1078498,"ירדן שועה על המוקד: ""יש כאלה שלא מעריכים אותך""",323,08/08/2025 07:39
גיא מויאל,1078493,לאחר 20 שנה: מאיה בוסקילה עושה קאמבק,464,08/08/2025 07:20
אלמוג אמר,1078490,"למרות אזהרת הרמטכ""ל: הקבינט אישר את כיבוש רצועת עזה ",234,08/08/2025 07:18
הדר הראל,1078400,"למה חתולים אוהבים קופסאות? התשובה, ועוד 4 סודות שהמדע פיצח",425,08/08/2025 07:01
כפיר אדר,1078492,גרושתו של אייל גולן נפרדת מישראל: ''הטיסה מרגישה נצח'',1072,08/08/2025 07:00
כפיר אדר,1078491,אברי גלעד מודה: ''אני מתעקש שנולדתי ליותר מזה'',317,08/08/2025 06:45
רוי שיינמן,1078468,מניית סולאראדג' עלתה ב-12% וסיימה במינוס 6% - זו הסיבה,3069,08/08/2025 06:42
כפיר אדר,1078489,סקר מנדטים משוגע: גדי אייזנקוט צובר תאוצה ונוגס בכולם,1215,08/08/2025 06:36
כפיר אדר,1078488,"עליית שכר ב-14% ו-2,500 שקל מענק: אלו העובדים בישראל שירוויחו",8113,08/08/2025 06:28
כפיר אדר,1078487,ביטוח לאומי בבשורה חשובה: זה המענק שתקבלו ב-28.8,30479,08/08/2025 06:24
אפרת בבג'ני,1078455,"שוויץ חוטפת מטראמפ ""קנס"": כיצד יגיב הבנק המרכזי?",260,08/08/2025 06:20
אפרת בבג'ני,1078467,בנק One Zero בבשורה אדירה לישראלים: דירוג הפרסומות הטובות,804,08/08/2025 06:20
כפיר אדר,1078485,משרד הבריאות בריקול לתרופה הזו: ''להפסיק מיידית את השימוש'',2648,08/08/2025 06:19
רוי שיינמן,1078213,כמה כסף שמים המשקיעים הזרים בישראל? המספרים נחשפים,505,08/08/2025 06:05
ענת סימן טוב,1078452, בשורה משמחת לטסים: חברת הלואו קוסט הענקית חוזרת היום לישראל  ,515,08/08/2025 06:03
ענת סימן טוב,1078456,"מנכ""ל הסטוק: ""אנחנו כבר עובדים על חזרה לבית ספר לשנה הבא""  ",461,08/08/2025 06:03
ענת סימן טוב,1078461,פער של כ-200 שקל בין רשתות המזון: איפה תשלמו הכי פחות בקניות לשישי?,451,08/08/2025 06:03
כפיר אדר,1078371,כניסת השבת: מתי השבת נכנסת ויוצאת ומה יהיה מזג האוויר?,202,08/08/2025 05:56
כפיר אדר,1078354,ראש העיר נפרד בכאב: ''נגאל מייסוריי מחלת הריאות הקשה'',12480,08/08/2025 05:54
רויטל ונונו,1078484,הטיפ הפשוט שיהפוך את הלחם שלכם לבריא יותר,342,08/08/2025 04:16
רויטל ונונו,1078483,"אסתי גינזבורג: ""יש לי הפרעות אכילה. הייתי מרעיבה את עצמי""",493,08/08/2025 03:53
יהודה רוזן,1078482,"אחרי 35 שנה: הזמר המזרחי האהוב בצעד דרמטי - ""חיכיתי לרגע הזה""",2108,08/08/2025 03:36
יהודה רוזן,1078481,באמצע ההופעה: הזמר קיבל את הבשורה המרגשת על הולדת בתו | צפו,519,08/08/2025 02:50
רויטל ונונו,1078480,"המחאה נגד עומר אדם: ""כל הקהל התיישב בשנייה""",401,08/08/2025 02:50
יהודה רוזן,1078479,"ערן זהבי מודה באומץ: ""עשיתי טעות קשה. אני לא נהנה""",575,08/08/2025 02:01
יהודה רוזן,1078477,מסעיר את העולם: חשד שבת זוגתו בוגדת בו - זה המעשה המחריד שעשה,685,08/08/2025 01:50
רויטל ונונו,1078478,"השינוי המרגיז במשקה הפופולרי: ""המתכון החדש"" של המיץ מכעיס צרכנים",579,08/08/2025 01:49
יהודה רוזן,1078476,כף חמאה גרמה למשבר דיפלומטי: איטליה נגד בריטניה,203,08/08/2025 00:57
רויטל ונונו,1078475,"רותי ברודו בטינדר: ""אני הולכת על זה""",373,08/08/2025 00:41
רויטל ונונו,1078474,גמר המטבח המנצח: המתמודדת פרשה לנוח והפסידה את התחרות,1895,07/08/2025 23:57
יהודה רוזן,1078473,וול סטריט ננעלה במגמת ירידה: מה גרם לנפילה של דאו ג'ונס?,284,07/08/2025 23:32
יהודה רוזן,1078472,הולמס פלייס בעסקת ענק: רכשה רשת מועדוני פילאטיס מכשירים ,906,07/08/2025 22:58
אפרת בבג'ני,1078471,"פליטת ""האח הגדול"" מודה: ""אני מתה מפחד שתראו את זה""",712,07/08/2025 22:50
אפרת בבג'ני,1078469,אוהבים בצק עוגיות? קבלו את המתכון המקורי מבן & ג'ריס  ,280,07/08/2025 22:30
יהונתן פרי,1078470,אילון מאסק וסטארלינק מתחילים לפעול בישראל: כמה זה יעלה לכם?,659,07/08/2025 22:19
דויד ויצמן,1078465,נבואת הזעם של בכיר בגוגל לשעבר: כולנו בסכנה,458,07/08/2025 22:06
יהודה רוזן,1078464,"אל על באזהרה חמורה: ""לנקוט משנה זהירות. לא לשתף""",1899,07/08/2025 21:22
יהונתן פרי,1078466,סקר מנדטים דרמטי: איך ההתפתחויות האחרונות השפיעו על הגושים?,2310,07/08/2025 21:20
אפרת בבג'ני,1078463,"כוכבת ""הזמר במסכה"": ""קיבלתי התקף קלסטרופוביה, היה קשה לנשום""",429,07/08/2025 21:04
רוי שיינמן,1078166,"מנכ""ל yes ופלאפון בראיון: ""כך תיראה התקופה הקרובה""",3944,07/08/2025 20:56
דויד ויצמן,1078460,ברצלונה בהלם: שחקן המפתח עובר לקבוצתו של כריסטיאנו רונאלדו,9907,07/08/2025 20:55
כפיר אדר,1078374,מהפכה ברכבת ישראל: זה המהלך שיקצר את הנסיעה בחצי,1019,07/08/2025 20:44
יהודה רוזן,1078459,בנט מטיח האשמות חמורות - והיועץ לשעבר של נתניהו מתפוצץ בתגובה,767,07/08/2025 20:43
דויד ויצמן,1078453,"אבי מלר משתף על מצבו: ""אני חולה אבל מרגיש בריא""",1735,07/08/2025 20:33
רפאל בן זקרי,1078457,נחשף שדרוג ענק ל-ChatGPT - זו קפיצת המדרגה שכולם חיכו לה?,723,07/08/2025 20:27
דויד ויצמן,1078444,טראמפ בתקדים היסטורי: קריפטו כנכס פנסיוני,302,07/08/2025 20:19
אפרת בבג'ני,1078450,עומר אדם חושף: זו הכוכבת הגדולה שתלווה אותו בערב ההיסטורי,474,07/08/2025 20:02
אפרת קרסנר,1078451,אחרי 15 שנה: העורכת הבכירה בידיעות אחרונות עוזבת את תפקידה,407,07/08/2025 20:01
רפאל בן זקרי,1078449,"טראמפ ואפל חוגגים: כמה שווה המתנה שהעניק המנכ""ל לנשיא?",343,07/08/2025 19:35
אפרת בבג'ני,1078448,לירון רביבו הגיעה לטיפול נמרץ: הכוכבת חושפת דרמה רפואית ,365,07/08/2025 19:28
כפיר אדר,1078383,עוקץ החזרי המס הגדול בישראל: כך עובדת השיטה מתוך רשות המסים,1418,07/08/2025 19:28
דויד ויצמן,1078447,"קריאות ""נאצים"" וזריקת אבנים - חרדים מפגינים נגד המעצרים",448,07/08/2025 19:21
כפיר אדר,1078377,גרושתו של אייל גולן חוגגת יום מאושר: ''מלך מלכי המלכים שלי'',660,07/08/2025 19:08
אפרת בבג'ני,1078446,"מאור ברוכמן על כוכבת ""האח הגדול"": ""אני אוהבת אותה מאוד""",813,07/08/2025 18:56
כפיר אדר,1078410,עיר חדשה בישראל - לחרדים בלבד: איפה היא תוקם?,793,07/08/2025 18:53
אפרת בבג'ני,1078445,"סיכום המסחר בבורסה: עליות במדדים, זו המניה שצמחה ב-5.3%",369,07/08/2025 18:40
דויד ויצמן,1078441,"טראמפ נגד המנכ""ל המוביל: ""אתה חייב להתפטר!""",414,07/08/2025 18:31
טל גורן,1078366,צעירה יצאה מביתה ונעלמה: זה מה שהתגלה מספר שעות לאחר מכן,328,07/08/2025 18:21
אפרת בבג'ני,1078442,"שר הביטחון לשעבר: ""ממשלת המשיחיים והמושחתים חייבת לחלוף מן העולם""",353,07/08/2025 18:13
כפיר אדר,1078395,ביטוח לאומי מחלק מענק מיוחד: כך תדעו שאתם זכאים לקבל,682,07/08/2025 18:11
רעי שני,1078438,"נתיבי איילון ייחסמו, שיבושים ברכבת ישראל: זה מה שיקרה בשבוע הבא",430,07/08/2025 18:04
רוי שיינמן,1078419,למה מניית ענקית התרופות צוללת ב-14%?,505,07/08/2025 17:58
אפרת בבג'ני,1078439,"חטיפים, שוקולדים ומוצרים ישראליים: התיעוד ששם סוף לשקר של חמאס",253,07/08/2025 17:55
דויד ויצמן,1078436,מאסק נגד אלטמן: מאבק על התואר הנחשב בעולם הAI,267,07/08/2025 17:54
יהונתן פרי,1078440,"אימו של כוכב האח הגדול: ""הוא פוגע בעצמו""",7626,07/08/2025 17:48
רעי שני,1078437,מהפכה בתחבורה הציבורית בישראל: זה מה שיקרה באחת התחנות העמוסות,439,07/08/2025 17:36
כפיר אדר,1078367,חברת התעופה שהישראלים אוהבים בבשורה גדולה: זה השינוי שמגיע,382,07/08/2025 17:33
אפרת בבג'ני,1078435,"השחקנית הישראלית בת ה-45: ""הם מונעים חשמל ומים זורמים לעזה""",380,07/08/2025 17:30
רפאל בן זקרי,1078425, מאסק חושף מתחרה לגוגל ו-OpenAI: הכלי החדש שכבר מעורר סערה,513,07/08/2025 17:30
כפיר אדר,1078406,רשות המסים חושפת הונאה בסיוע ההומניטרי לעזה: מה הבריח היבואן?,473,07/08/2025 17:10
רעי שני,1078434,"יוסף חדאד מגיב לראשונה לכתב האישום: ""כלום לא יעצור אותי""",1211,07/08/2025 17:10
רעי שני,1078432,זוועה בתחבורה הציבורית בישראל: חרדי תקף אישה באוטובוס - ונעצר,498,07/08/2025 16:56
אפרת בבג'ני,1078433,"שניר בורגיל: ""תודה על הניסיונות הקשים להרוס אותנו כמשפחה""",6029,07/08/2025 16:51
דויד ויצמן,1078420,"הפגינו נגד ישראל - וכעת יעמדו לדין: ""שקלו את צעדיכם""",1242,07/08/2025 16:48
דויד ויצמן,1078429,שערורייה: התחזתה לאחות וראתה כ־4000 מטופלים,348,07/08/2025 16:48
רעי שני,1078431,"דרמה בנתב""ג: בודקי המכס תפסו על חם הברחה בשווי מאות אלפי שקלים",613,07/08/2025 16:40
רעי שני,1078430,הזמר האהוב הלך לעולמו בגיל 76 - כעת האמת הכואבת נחשפת,2296,07/08/2025 16:34
אפרת בבג'ני,1078426,הסוף לאיום על משקיעי הקריפטו: זה הפתרון שיגן על מיליוני ארנקים,456,07/08/2025 16:26
צוף צימרינג,1078428,,0,07/08/2025 16:24
כפיר אדר,1078394,נועה קירל מכניסה גבר חדש לחייה: מי הצמוד החדש שלה?,807,07/08/2025 16:17
רעי שני,1078424,עומר אדם נחשף: לא תאמינו כמה שווה השעון שעונד הכוכב,2330,07/08/2025 16:15
רוי שיינמן,1078348,למרות ההכרזה של טראמפ: מניית ענקית השבבים מזנקת ,371,07/08/2025 16:11
רוי שיינמן,1078379,ענקית הרכב מורידה את התחזית - זה הסכום שתפסיד,317,07/08/2025 16:09
רעי שני,1078423,אדמונד ספרא ישלם ביוקר? המאמן המפוטר דורש פיצויים בכמיליון שקל,620,07/08/2025 16:03
אפרת בבג'ני,1078422,"מגיש חדשות 12 באמירה מדאיגה: ""דינם של החטופים נחרץ""",432,07/08/2025 15:53
רעי שני,1078421,"יוסף חדאד ספג כתב אישום חמור: ""תעודת עניות לפרקליטות הפוליטית""",1358,07/08/2025 15:47
כפיר אדר,1078402,שדרוג השכר ב-12%-16% ומענקים מפנקים: אלו העובדים שירוויחו,333,07/08/2025 15:42
רעי שני,1078418,"הקריפטו היומי: הביטקוין מטפס, אלו שלושת המטבעות שזינקו בכ-7%",260,07/08/2025 15:41
ענת סימן טוב,1078417,גם זה קורה: השיחה המוזרה ברשת רמי לוי,670,07/08/2025 15:33
אפרת בבג'ני,1078416,פרויקט המגורים של ניר עוז יוצא לדרך: כמה יחידות דיור יוקמו?,387,07/08/2025 15:30
רוי שיינמן,1078407,המניה הישראלית שמזנקת ב-13% בוול סטריט,373,07/08/2025 15:18
אפרת בבג'ני,1078412,"ברק סרי מתפוצץ על נוה דרומי: ""תני לי לדבר, את מפריעה""",579,07/08/2025 15:13
רעי שני,1078415,מכה לנהגים בישראל: שיבושים ועומסי תנועה כבדים בכבישים המרכזיים,1095,07/08/2025 15:13
רפאל בן זקרי,1078341,החברה הישראלית שווה מעל 3 מיליארד דולר - וזה הסכום שגייסה,458,07/08/2025 15:09
אפרת קרסנר,1078411,נועה קירל ואנה זק ראש בראש: מי הודחה מהמצעד הנחשק?,404,07/08/2025 15:06
ענת סימן טוב,1078414,גל חום קיצוני: גידול של 1500% בביקוש למוצרי אוורור,399,07/08/2025 15:05
רוי שיינמן,1078408,חברת השבבים הישראלית ברבעון שיא: איך מגיבה המניה?,322,07/08/2025 14:57
רעי שני,1078404,רשות המסים יצאה למלחמה: חברות האשראי בישראל ישיבו מאות מיליונים,498,07/08/2025 14:55
אלמוג אמר,1078405,סקר חדש חושף: זה מה שהציבור הישראלי חושב על עסקת חטופים ,381,07/08/2025 14:52
אפרת קרסנר,1078403,"טל פרידמן חושף את הרגע המרגש בחייו: ""יש לי צמרמורת כשאני נזכר""",499,07/08/2025 14:45
כפיר אדר,1078356,אופירה אסייג תעדר מהמסך: זו ההודעה המפתיעה של המגישה ,2280,07/08/2025 14:43
כפיר אדר,1078365,ברבע מיליון שקל: החגיגה המוגזמת של גל גדות ובעלה נחשפת,9745,07/08/2025 14:38
כפיר אדר,1078343,רשות המסים חושפת: כך ביטול הטבת המס השפיעה על שוק הרכב,244,07/08/2025 14:37
רעי שני,1078401,פיטורים בהייטק הישראלי: זו החברה ששולחת עשרות עובדים הביתה,983,07/08/2025 14:33
אפרת קרסנר,1078399,"20 שנה אחרי ההתנתקות: ""אם היינו ב-7 באוקטובר בגוש קטיף היו שוחטים אותנו""",209,07/08/2025 14:31
רעי שני,1078392,בכיר במשטר האיראני הוצא להורג בטענה לריגול עבור ישראל,223,07/08/2025 14:24
אלמוג אמר,1078396,למרות שעקפה את התחזיות: מניית ענקית הסייבר צוללת - זו הסיבה ,355,07/08/2025 14:24
טל גורן,1078398,"מודחת האח הגדול תוקפת את שלקה: ""עושה הצגות כדי למשוך תשומת לב""",6230,07/08/2025 14:19
הדר הראל,1078391,מאירים את הדרך: 5 המגדלורים היפים והמפורסמים בעולם (ואחד משלנו),437,07/08/2025 14:07
רוי שיינמן,1078390,סולאראדג' מכה את הצפי בדוחות: המניה מזנקת,1403,07/08/2025 14:05
אלמוג אמר,1078386,"קבוצת הנדל""ן מציגה: עסקה בסך עשרות מיליונים בערים המבוקשות",386,07/08/2025 14:00
כפיר אדר,1078339,קניתם רכב חדש? אל תתפלאו אם קיבלתם יד שנייה במקום,436,07/08/2025 13:57
טל גורן,1078389,"גופת הפעוטה שננשכה ע""י הפיטבול לא תוצא מהקבר: זו תגובת האב",470,07/08/2025 13:57
רעי שני,1078393,יוסף חדאד מסתבך בענק: זה כתב האישום החמור שהוגש נגדו,1496,07/08/2025 13:56
אפרת קרסנר,1078388,הדוגמנית הישראלית בהישג ענק: קוטפת קמפיין בינלאומי יוקרתי,508,07/08/2025 13:47
כפיר אדר,1078342,אלי אוחנה חושף את הקשיים הכלכליים: ''מתקלחים עם גיגית בחוץ'',634,07/08/2025 13:43
כפיר אדר,1078387,מכרז השכרת הרכבים הגדול הוכרעה: מי ידאג למערכת הביטחון?,245,07/08/2025 13:39
רעי שני,1078376,הפוסט שעורר סערה: מה הסיבה שהשליח של וולט זרק את ההזמנה?,674,07/08/2025 13:34
אפרת קרסנר,1078385,סאבלימינל נתקע ונאלץ להזעיק חילוץ: הדרמה הלילית של הראפר,278,07/08/2025 13:33
ירון שמאי,1078380,זוכה הריאליטי תרם את כל כספי הפרס: מי קיבל רבע מיליון שקל?,618,07/08/2025 13:27
אלמוג אמר,1078382,משרד הבריאות מתריע: הנגיף המסוכן אותר במיקומים נוספים בארץ ,335,07/08/2025 13:26
אפרת קרסנר,1078378,"אשתו של יאיר לפיד חושפת את המשבר ביחסים: ""אני התרסקתי לגמרי""",30854,07/08/2025 13:15
ענת סימן טוב,1078381,צרכנות בשעת חירום: רשתות המזון חוגגות על הפדיון,388,07/08/2025 13:10
צוף צימרינג,1078372,יעל שלביה בפיג'מה: כך נתפסה בעדשות הפפראצי,1590,07/08/2025 13:05
