שם,מספר כתבה,כותרת,צפיות,תאריך יצירה
כפיר אדר,1083770,הריבית עומדת לרדת בחדות? ''אחוזים בודדים להורדה של 0.5%'',418,14/09/2025 08:59
רעי שני,1083772,דרמה בענקית התעופה: הטייסים הקניטו את צ'רלי קירק והושעו,339,14/09/2025 08:56
כפיר אדר,1083769,בנק הפועלים בבשורה מרגשת: זה מה שיקרה החל מהיום,871,14/09/2025 08:30
רעי שני,1083768,תאונת דרכים קשה ביעד האהוב: 8 מטיילים ישראלים נפצעו,534,14/09/2025 08:30
יונתן סידון,1083766,בין ריבית למיסים: אתגרי המדיניות הכלכלית בישראל,1120,14/09/2025 08:19
איציק יצחקי,1083729,"מנכ""ל התאחדות הקבלנים: ""אנחנו לקראת פיצוץ בשוק הדיור""",1716,14/09/2025 08:19
רעי שני,1083767,ארז איסקוב בטרגדיה כואבת: האמת הקשה על הנהג שדרס את סבתו נחשפת,22064,14/09/2025 08:15
כפיר אדר,1083757,ינון מגל מצטלם לסדרה חדשה: הצעד הבא של כוכב ערוץ 14,3186,14/09/2025 08:07
רעי שני,1083765,שון וייסמן משתיק את כולם: התשובה של הישראלי למתקפות האנטישמיות,760,14/09/2025 07:58
רוי שיינמן,1083761,לקראת שבוע המסחר: מה צפוי בבורסה?,352,14/09/2025 07:39
רעי שני,1083764,בנק מזרחי טפחות: הכלכלה בישראל ממשיכה להפתיע בענק,367,14/09/2025 07:38
רעי שני,1083759,ליאו מסי מושפל: הישראלי שעשה בית ספר לכוכב הגדול מכולם,749,14/09/2025 07:32
רפאל בן זקרי,1083760, המהפך של אפל: האייפון 17 כבר לא מיועד לכולם?,1433,14/09/2025 07:27
כפיר אדר,1083758,ביטוח לאומי בבשורה משמחת ליהודה לוי ודנה פרידר: זה המענק שיקבלו,811,14/09/2025 07:26
כפיר אדר,1083750,"רשות המסים מחכה ליובל לוי: כמה יאבד מה-950,000 שקל שזכה?",1393,14/09/2025 07:01
כפיר אדר,1083755,"רמי לוי חושף לראשונה: ''הפסקתי למכור, לא היה כדאי''",2659,14/09/2025 07:00
כפיר אדר,1083753,תגובה ראשונה לטרגדיה של ארז איסקוב: ''איזה יום עצוב'',13246,14/09/2025 06:37
אפרת קרסנר,1083723,חרם על ישראל בהוליווד: זו הכוכבת שמגוננת,481,14/09/2025 06:21
כפיר אדר,1083751,יהודה לוי ודנה פרידר בהיריון ראשון: ''חיכינו כבר להעניק לכם'',678,14/09/2025 06:17
ענת סימן טוב,1083699,פער של 74% על פירות וירקות: זו הרשת הזולה ביותר,515,14/09/2025 06:03
כפיר אדר,1083734,בגיל 46: אלמוג בוקר בבשורה מרגשת במיוחד,1867,14/09/2025 06:02
איציק יצחקי,1083718,"מנכ""ל חברת הנדל""ן טס לפריז - ומכר דירות ב-60 מיליון שקל",5754,14/09/2025 06:02
כפיר אדר,1083739,האח הגדול מוכר ביוקר: מי שילמה מאות אלפי שקלים לפרסומת הזהב?,803,14/09/2025 06:02
יהודה רוזן,1083749,"המיליונים של נתניהו תפחו - מה יעשה רה""מ בסכום המטורף שנחסך?",3224,14/09/2025 05:02
יהודה רוזן,1083748,יובל לוי ניצח? זה מה שעשה הכוכב המפורסם של האח הגדול בזמן הגמר,809,14/09/2025 03:32
יהודה רוזן,1083747,אתונה: הישראלים הותקפו בידי פלסטינים ועוכבו יחד עמם לחקירה ,394,14/09/2025 03:14
יהודה רוזן,1083746,מגישת החדשות הצעירה הביסה את הערוצים הוותיקים - וזו תגובתה,984,14/09/2025 02:53
יהודה רוזן,1083745,חדשות 12 ו-13 נכנעו? ההבנות הסודיות עם מקורבו של בן גביר נחשפות,508,14/09/2025 02:41
יהודה רוזן,1083744,סליחות מוזיקליות: הפיוטים העתיקים הפכו למופעי ענק הלילה | צפו,529,14/09/2025 02:16
יהודה רוזן,1083743,"צלם העיתונות הוותיק הוטח לרצפה - ""כמו שק תפוח אדמה"" | צפו ",901,14/09/2025 01:42
רויטל ונונו,1083742,יובל לוי מבהיר לאחר הניצחון: האם יש סיכוי לקאמבק עם שני אדרי?,2748,14/09/2025 01:25
רויטל ונונו,1083741,תגובת איסקוב לאחר הבשורה על מות סבתו – מה ביקשה משפחתו?,12483,14/09/2025 00:36
רויטל ונונו,1083740,צופי האח הגדול מבולבלים: מי האישה הלא מזוהה שישבה עם שאר הדיירים?,2874,13/09/2025 23:53
כפיר אדר,1083736,"הזוכה באח הגדול נחשף: יובל לוי לקח את 950,000 השקלים",4570,13/09/2025 23:43
טל גורן,1083738,"מאי גולן הותקפה ע""י מפגינים: ""אם אלה היו פעילי ימין, המהדורות היו נפתחות""",703,13/09/2025 22:55
כפיר אדר,1083737,אייל גולן חוגג יום מאושר: ''ברמות שאני לא יכול להסביר'',977,13/09/2025 22:35
טל גורן,1083735,"איומים על חייו של שר בממשלה: ""אמשיך לפעול למען תושבי ישראל""",499,13/09/2025 22:30
טל גורן,1083733,מודי ציפור בצעד דרמטי: זו הייתה תגובתה של גל רובין למהלך,732,13/09/2025 22:12
כפיר אדר,1083732,סבתא של ארז איסקוב נהרגה: נפגעה בתאונת דרכים לפני הגמר,9294,13/09/2025 22:07
הדר הראל,1083727,"לא ביטקוין, לא את'ריום: זה המטבע הדיגיטלי שזינק לשיא כל הזמנים השבוע",9884,13/09/2025 21:55
טל גורן,1083724,הפגנת ענק בבריטניה נגד ההגירה: מדוע הונף דגל ישראל?,408,13/09/2025 21:53
כפיר אדר,1083728,גמר האח הגדול: ארז איסקוב ויובל לוי נותרו אחרונים בבית,2644,13/09/2025 21:47
יהודה לוינגר,1083725,"זהבה גלאון: ""ממשלה שמקריבה את חטופיה, מדינה פלסטינית - הפתרון היחידי""",227,13/09/2025 21:46
הדר הראל,1083722,גבולות נשברים בוול סטריט: ענקיות הטכנולוגיה מכתיבות את גורל השוק,324,13/09/2025 21:42
כפיר אדר,1083726,זוכה האח הגדול הקודם מתעלם? זה מה שיעשה בזמן הגמר,638,13/09/2025 21:39
רוי שיינמן,1083559,הגורו שמנצח את השוק: הכירו את רון בארון,695,13/09/2025 21:32
טל גורן,1083721,"נתניהו מודה בכישלון התקיפה בקטאר: ""אם מחבלי חמאס יחוסלו תיגמר המלחמה""",336,13/09/2025 21:29
כפיר אדר,1083720,צרפת תכריז על מדינת 'פלסטין' ומסתבכת: זו המכה הכלכלית שחטפה,2227,13/09/2025 21:22
כפיר אדר,1083719,אלירז שדה חוטף מכוכב גולסטאר: ''מקבל נוק אאוט'',392,13/09/2025 21:17
טל גורן,1083715,"אשתו של קירק מגיבה לראשונה על הרצח: ""העולם מלא רוע""",427,13/09/2025 21:11
יהודה לוינגר,1083717,איילה חסון חושפת תעלומה מטלטלת: מדוע מסוק הקרב לא ירה במחבלים בנובה?,1346,13/09/2025 21:10
אפרת קרסנר,1083716,אירוויזיון 2026: זו התשובה הישראלית למדינות שהטילו חרם,611,13/09/2025 21:06
יהודה לוינגר,1083707,"yes מורידה את ערוץ דיסקאברי מסטינג, והמנויים כועסים: ""מאכזב מאוד""",1423,13/09/2025 20:54
כפיר אדר,1083714,יהודה לוי ודנה פרידר מטילים פצצה: עומדים להפוך לראשונה להורים,3488,13/09/2025 20:51
טל גורן,1083713,"רונן צור תוקף את ינון מגל: לא תשרוד מולי יממה וחצי""",772,13/09/2025 20:49
כפיר אדר,1083712,אייל שני וישראל אהרוני רבים בשידור: מה גרם לפיצוץ?,419,13/09/2025 20:35
כפיר אדר,1083711,האח הגדול בדרמת ענק: כוכב העונה חש ברע ויפספס את הגמר,766,13/09/2025 20:18
אפרת קרסנר,1083708,"סערה בהוליווד בעקבות הקריאה לחרם על ישראל: ""לא מקדם את השלום""",316,13/09/2025 20:10
כפיר אדר,1083710,המיליארדר הישראלי התחתן ב-19.5 מיליון שקל: על מה בוזבז הכסף?,3951,13/09/2025 20:08
כפיר אדר,1083709,ביטוח לאומי בבשורה משמחת: זה המענק שתקבלו ב-28.10,6810,13/09/2025 19:59
כפיר אדר,1083706,ביזיון באופיס דיפו: עובדת לקחה החלטה הזויה וכך הגיבה הרשת,444,13/09/2025 19:54
טל גורן,1083705,"בנימין נתניהו לא יוכל להיכנס לניו יורק? ""אם יגיע הוא ייעצר""",381,13/09/2025 19:52
יהודה לוינגר,1083702,נווה דרומי וחדשות i24News בזינוק חד ברייטינג: הקרב על שישי נפתח מחדש,1044,13/09/2025 19:49
כפיר אדר,1083704,אקזיט ענק בקולינריה הישראלית: זו הרשת שתימכר ברבע מיליארד שקל,968,13/09/2025 19:46
אפרת קרסנר,1083701,אירוויזיון 2026: המדינות שעד עכשיו שתקו בנוגע לישראל קיבלו החלטה,24430,13/09/2025 19:46
טל גורן,1083703,"מאור ברוכמן נגד תרצה כהן: ""רעשנית וצבועה, לא מגיע לה לזכות""",1077,13/09/2025 19:44
ירון שמאי,1083700,אישום: רופא מרדים נטש ניתוח – כדי לקיים יחסי מין עם אחות,531,13/09/2025 19:40
ירון שמאי,1083698,רוני מאנה חושף: למה אבנר נתניהו ביטל את החתונה?,65283,13/09/2025 19:40
טל גורן,1083672,"הרייטינג השבועי: רשת 13 תתגעגע לאח הגדול, חדשות 12 מובילה בבטחה",750,13/09/2025 19:28
הדר הראל,1083669,"זה המנצח הגדול של ""האח הגדול"" 2025 | ניתוח מלא",6701,13/09/2025 19:28
הדר הראל,1083612,מחקר חדש ומטריד: ההרגל התמים הזה מחבל לכם בבריאות,775,13/09/2025 19:28
טל גורן,1083657,"דירוג עשירי ישראל: מרים אדלסון שומרת על הפסגה, עידן עופר עולה",3425,13/09/2025 19:28
כפיר אדר,1083697,בגיל 75: גידי גוב חושף את בת הזוג הצעירה שלו,52119,12/09/2025 17:31
כפיר אדר,1083696,דובי פרנסס חושף: המהלך הגדול הראשון עם אבנר נתניהו,7416,12/09/2025 17:20
ענת סימן טוב,1083582,"""אנחנו מתכננים להיכנס לעולם הגיפט-קארדים"" מנכ""ל ZER4U בראיון מפתיע",1439,12/09/2025 17:20
כפיר אדר,1083695," יובל מעתוק חושפת: זה הזוכה שלי ב""האח הגדול""   ",2027,12/09/2025 16:00
כפיר אדר,1083694,ביזיון: נבחרת ישראל התבקשה להסיר את הדגל וכך החליטה להגיב,39902,12/09/2025 15:38
כפיר אדר,1083693,עונש המוות מחכה: המתנקש בצ'רלי קירק נתפס תוך 48 שעות,1353,12/09/2025 15:18
יהודה לוינגר,1083691,המהפכנים באים: מה סודו של העם היהודי? ,418,12/09/2025 15:11
כפיר אדר,1083671,אוהד בוזגלו חושף את הירידה של הוריו מישראל: ''לא יחזיק מעמד'',779,12/09/2025 15:01
כפיר אדר,1083692,רשות המסים זוכה באח הגדול: זה הסכום שייאבד מחר המנצח,3987,12/09/2025 15:00
רפאל בן זקרי,1083652,נבחרת הקריפטו מסבירה: בקרוב תוכלו לסחור במניות על בלוקצ'יין?,799,12/09/2025 15:00
כפיר אדר,1083690,הדוגמנית הישראלית מתחתנת עם מיליארדר: זה השווי המטורף של החתן,11929,12/09/2025 14:50
יהודה לוינגר,1083689,לבקש סליחה בשמחה: הפטנט היהודי והמנעד הרגשי,375,12/09/2025 14:49
יהודה לוינגר,1083688,היסטוריה בעולם השחמט: רב האמן בן ה-16 מנצח את אלוף העולם,524,12/09/2025 14:40
כפיר אדר,1083687,ישראל תסולק מאירוויזיון 2026? גם המדינה הזו מאיימת לפרוש,1166,12/09/2025 14:05
כפיר אדר,1083686,גל הפיגועים בישראל לא מפסיק: 2 פצועים בפיגוע דקירה במלון,455,12/09/2025 13:54
כפיר אדר,1083668,חיים לוינסון שונא את תל אביב? ''כל העיר הזאת מסריחה'',735,12/09/2025 13:42
כפיר אדר,1083685,המועדון האהוב נסגר אחרי 25 שנה: ''לא יכולים יותר'',5502,12/09/2025 13:38
טל גורן,1083684,הקלה בעונשו של היהלומן ישראל אור: זו עסקת הטיעון אליה הגיע,780,12/09/2025 13:21
טל גורן,1083682,"כתב חדשות 13 זועם: ""מישהו צריך להזכיר לו שהוא נאשם בפלילים""",1777,12/09/2025 13:03
אפרת קרסנר,1083623,חדש על המסך: כל מה שחם ומעניין בטלוויזיה השבוע,429,12/09/2025 13:03
כפיר אדר,1083683,"אייל שני עובר השפלה: ''בואי נלך, זה מקום של יהודים''",1044,12/09/2025 13:01
טל גורן,1083681,"אביב אלוש סופד לצ'רלי קירק: ""עמד איתן מול השקר הפרו פלסטיני""",358,12/09/2025 12:44
יהודה לוינגר,1083678,"עם כיפה ותפילין: סטטיק מתחזק בדת במהלך סבב ההופעות בארה""ב",374,12/09/2025 12:17
טל גורן,1083655,"דירוג עשירי העולם: שינויים רבים בצמרת, האם לארי אליסון כבש את הפסגה?",10819,12/09/2025 12:17
כפיר אדר,1083646,ספיר בורגיל מתוודה: ''לא תדע לעולם כמה אני אוהבת אותך'',1076,12/09/2025 12:16
טל גורן,1083679,"טראמפ מתוסכל מנתניהו: ""בכל פעם שהם מתקדמים, הוא מפציץ מישהו""",293,12/09/2025 12:14
כפיר אדר,1083680,קנס חדש של 100 שקל ו-2 נקודות: מה יקרה מה-1.11?,1671,12/09/2025 12:13
כפיר אדר,1083677,"לקוחות רמי לוי, קרפור ושופרסל? זה המוצר שעושה מהפכה בסניפים",688,12/09/2025 12:07
טל גורן,1083675,"הקריפטו היומי: עלייה בכלל המטבעות, הדוג'קוין מזנק",474,12/09/2025 11:55
רפאל בן זקרי,1083557, בדיקה: זה המסך המשתלם לגיימרים מתחילים?,437,12/09/2025 11:54
כפיר אדר,1083676,עומר אדם נחשף בזוגיות חדשה: זה התיעוד שמבלבל את כולם,2505,12/09/2025 11:53
כפיר אדר,1083674,"דני קושמרו מתלונן: ''רעיל פה מדי, לא יכול להיות כאן''",29000,12/09/2025 11:47
כפיר אדר,1083673,עופר ינאי חוטף בלוק: השכר החלומי לא ייצא אל הפועל,1942,12/09/2025 11:35
אפרת קרסנר,1083626,"עדי אשכנזי, רותם אבוהב או ציפי שביט? זו הקומיקאית האהובה בישראל",406,12/09/2025 11:15
כפיר אדר,1083670,בגיל 57: הזמר הישראלי האהוב נפצע קשה בצילומי הקליפ,1290,12/09/2025 11:05
טל גורן,1083667,התפתחות בפרשת אוטומקס: זו ההחלטה שקיבל בית המשפט,1015,12/09/2025 10:49
איציק יצחקי,1083204,רחוק מהמרכז: היכן נמכרה דירת 4 חדרים ב-3.9 מיליון שקל?,1198,12/09/2025 10:36
כפיר אדר,1083654,מגיש חדשות 12 באמירות קשות: ''רק משורות הימין נשלף האקדח'',883,12/09/2025 10:36
הדר הראל,1083665,מחקר חדש ומטריד: כימיקלים רעילים התגלו ב-95% מהבירות,502,12/09/2025 10:35
אפרת בבג'ני,1083616,סיכום המסחר השבועי: המדדים המובילים שברו פעמיים את שיא כל הזמנים,361,12/09/2025 10:31
טל גורן,1083664,"בן כספית תוקף: ""נתניהו הופך אותנו למדינה מצורעת בעולם""",1131,12/09/2025 10:31
כפיר אדר,1083666,נשות המילואים זוכות להוקרה: ''תחושה של הערכה אמיתית'',300,12/09/2025 10:30
הדר הראל,1083663,שיטה חדשה והזויה לסחור ב-S&P500? זו התרנגולת שעושה לכם בית ספר,498,12/09/2025 10:16
כפיר אדר,1083662,גמר האח הגדול הוכרע? זו התמונה שחושפת מי הזוכה של העונה,6834,12/09/2025 10:12
טל גורן,1083661,"חזי דין חושף את תחילת דרכו: ""חיפשתי אנשים משוגעים סביבי""",884,12/09/2025 10:05
כפיר אדר,1083660,איש העסקים המוכר על הכוונת? רימון הושלך לביתו בהרצליה,858,12/09/2025 09:51
טל גורן,1083658,"רייטינג: חתונה ממבט שני לוקחת את המושכות, הפטריוטים מתאוששים",1169,12/09/2025 09:49
כפיר אדר,1083659,השחקנים בישראל נופלים קורבן לעוקץ אכזרי: הליהוק לסרט - הונאה,491,12/09/2025 09:44
כפיר אדר,1083656,הסוף לנהגי המוניות בישראל: זה המהלך שמעורר סערת ענק,1167,12/09/2025 09:37
טל גורן,1083653,שלמה קרעי קיבל החלטה: זה האירוע שיחרים משרד התקשורת,482,12/09/2025 08:30
כפיר אדר,1083647,דניאל גרינברג חושפת את הזוגיות עם אייל גולן: ''נשבר לי הלב'',1589,12/09/2025 08:22
טל גורן,1083648,דרמה בברזיל: הנשיא לשעבר נידון ל-27 שנים בכלא,393,12/09/2025 08:09
כפיר אדר,1083650,המסים החדשים יביאו לקריסה? מיליון אזרחים בסכנת עוני,947,12/09/2025 08:02
רוי שיינמן,1083494,"האנליסט הבכיר מדיסקונט: ""למרות התנודתיות - מעריך שיהיו עליות בבורסה""",1925,12/09/2025 07:15
הדר הראל,1083611,מדענים מצאו אוצר רפואי בקנאביס - והמפתיע:  זה החלק שכולם זורקים  ,446,12/09/2025 07:01
כפיר אדר,1083644,"אברי גלעד חושף: ''קיבלתי הצעה עסקית מעניינת, ים כסף''",1002,12/09/2025 07:00
כפיר אדר,1083643,ינון מגל מטיח בקהל הפטריוטים: ''מקווה שאתם לא שתולים'',387,12/09/2025 07:00
אפרת בבג'ני,1083433,עדי אשכנזי חושפת את הסוד לחיסכון בחשבון החשמל: דירוג הפרסומות,794,12/09/2025 06:45
כפיר אדר,1083645,"סקר מנדטים מפתיע: נתניהו מתחזק, איך יוסי כהן יבלגן הכל?",1045,12/09/2025 06:42
רפאל בן זקרי,1083615,בדקנו את הגלקסי החדש של סמסונג: זה המתקפל שמתאים לכולם?,614,12/09/2025 06:25
ענת סימן טוב,1083533,"מייסד האפליקציה שנלחמת בחברות התעופה: ""אפשר לקבל עד 1,500 יורו""",3232,12/09/2025 06:12
ענת סימן טוב,1083581,"רמי לוי, ויקטורי או קרפור? זו רשת המזון הזולה לשישי",641,12/09/2025 06:11
איציק יצחקי,1083461,"שוק הנדל""ן תחת מתקפה: עימותים בין בכירי הענף על רקע ההאטה",656,12/09/2025 06:01
כפיר אדר,1083641,רמי לוי שובר את השוק: כך תקבלו מחשב נייד ב-29.90 שקל,2369,12/09/2025 06:00
כפיר אדר,1083642,המיליארדר הישראלי בצרות? ההפסדים צמחו ב-130% לרבע מיליארד דולר,9660,12/09/2025 06:00
כפיר אדר,1083640,ביטוח לאומי מחלק היום מענקים למיליוני ישראלים: בדקו בחשבון הבנק,1268,12/09/2025 05:16
כפיר אדר,1083639,הילה קורח מתבאסת: ''תעשי ילדים הם אמרו'',821,12/09/2025 05:10
כפיר אדר,1083638,אבנר נתניהו ביטל את החתונה וישלם? ''לא מחזירה להם את המקדמה'',6094,12/09/2025 04:55
כפיר אדר,1083526,"כניסת השבת, יציאת שבת ומה מזג האוויר? 12.9.2025",370,12/09/2025 04:32
רויטל ונונו,1083637,"שירז בן ארי נגד מאי ערב: ""היא מנסה להוריד אותי ולכבות אותי""",2197,12/09/2025 04:18
רויטל ונונו,1083636,לא נעים: הקהל איים לעזוב את הופעתה של ריטה מול עיניה,38747,12/09/2025 03:41
רויטל ונונו,1083635,"רני רהב חוזר לליכוד? ""מפלגה מדהימה עם אנשים מדהימים""",950,12/09/2025 02:43
רויטל ונונו,1083634,"הזמר מוקי: ""הפכתי לאדם מאמין, מניח תפילין והולך לבית כנסת""",1883,12/09/2025 01:52
רויטל ונונו,1083633,"לינור אברג'יל על הטרגדיה שנקשרה במשפחתה: ""רמסו חיים של בן אדם""",1015,12/09/2025 00:50
רויטל ונונו,1083632,החרם גובר: עוד מדינה מאיימת לפרוש מהאירוויזיון אם ישראל תתחרה,436,12/09/2025 00:09
יהודה רוזן,1083631,מהפך בוול סטריט: הדאו ג'ונס פורץ רף היסטורי  - ואורקל בצניחה,402,11/09/2025 23:51
ירון שמאי,1083630,"מגיש מהדורת החדשות מבקש סליחה: ""אחינו לברית הדמים""",390,11/09/2025 22:59
אפרת בבג'ני,1083629,"ישראל על המפה: ""בעתיד נוביל פריצות דרך בתחום האנרגיה הנקייה""",401,11/09/2025 22:39
אפרת בבג'ני,1083628,הלהקה הישראלית תחת מתקפה: ביטלה את הופעתה באוסטרליה,392,11/09/2025 22:27
יהודה רוזן,1083627,עידן עמדי הדליק את פארק הירקון - החיילים והמשפחות לא נותרו אדישים,605,11/09/2025 22:25
אפרת בבג'ני,1083624,סקר מנדטים משוגע: כך האופוזיציה תצליח להביס בקלות את נתניהו,7826,11/09/2025 22:10
יהודה רוזן,1083625,"וויז אייר בבשורה קשה לנוסעים מנתב""ג: הקו ליעד הפופולרי ייסגר",2899,11/09/2025 22:08
יהודה רוזן,1083621,האקרים חדרו לסלולרי של שר הביטחון והפיצו תמונה מביכה משם | צפו,479,11/09/2025 21:41
ירון שמאי,1083622,אבנר נתניהו מבטל את החתונה המדוברת: נפרד מארוסתו עמית ירדני,11065,11/09/2025 21:38
איציק יצחקי,1083599,הערים שבהן נרשמה צניחה של מעל 50% במכירת דירות,1198,11/09/2025 21:27
ירון שמאי,1083620,חוקי הטיסה משתנים: זה הפריט שאסור לכם לקחת מהיום במזוודה,1333,11/09/2025 21:26
אפרת בבג'ני,1083619,"סקר מנדטים חדש: גנץ קורס, התקיפה בקטאר סייעה לנתניהו?",1093,11/09/2025 21:12
יהודה רוזן,1083618,"יונתן אוריך מתייחס לחשיפת התכתובות: ""עיניי דומעות ולבי כבד""",520,11/09/2025 20:59
אפרת בבג'ני,1083617,רוצים להשקיע ב-S&P 500 ללא עמלות? בנק לאומי בבשורה אדירה,650,11/09/2025 20:32
אפרת בבג'ני,1083592,"מגיש ערוץ 14 חושש לחייו: ""מפחד כבר תקופה ארוכה, נכנסו לביתי""",2722,11/09/2025 20:29
כפיר אדר,1083566,רמי לוי מודאג? זה מה שיקרה אצל המתחרים עד ה-28.9.25,596,11/09/2025 20:27
כפיר אדר,1083585,"שלקה חושפת את האמת על ""האח הגדול"": ""היא מחקה אותי''",1516,11/09/2025 20:05
אפרת בבג'ני,1083614,"תנובה מעוררת סערה - תחליף החלב נחשף: ""מגעיל, מרקם של דבק""  ",1648,11/09/2025 19:54
כפיר אדר,1083567,אלירז שדה בוכה בגלל אילנית לוי: ''רצינו להגיד לך שהגזמת'',648,11/09/2025 19:29
ירון שמאי,1083613,"איש העסקים לנתניהו: ""צא לנבצרות, תן לאנשים שפויים לנהל את המדינה""",965,11/09/2025 19:25
רוי שיינמן,1083577,מניית טסלה תמשיך לרדת? זה מה שחושבים המשקיעים,1821,11/09/2025 19:03
אפרת בבג'ני,1083609,על חשבוננו: למי מחלקת ועדת הכספים 400 מיליון שקלים?,414,11/09/2025 18:51
יהודה לוינגר,1083610,,0,11/09/2025 18:44
רפאל בן זקרי,1083602,הושק בישראל: זה המוצר שפותר את הבעיה הגדולה של שואבי האבק?,562,11/09/2025 18:44
אפרת בבג'ני,1083608,"סיכום המסחר בבורסה: חברות הביטוח צונחות, מי זינקה ביותר מ-4%?",379,11/09/2025 18:22
כפיר אדר,1083590,נועה קירל עוברת רגעי חרדה בגרמניה: ''מתחילה להלחץ והדופק עולה'',690,11/09/2025 18:20
יהודה לוינגר,1083607,"אל-ג'זירה נדהמו: ""ינון מגל חגג את התקיפה בקטאר עם שמפניה"" | צפו:",565,11/09/2025 18:18
