שם,מספר כתבה,כותרת,צפיות,תאריך יצירה
רויטל ונונו,1085543,"כוכבת הפטריוטים מתחזקת: ""שמרתי שבת. זה היה כיף גדול""",509,30/09/2025 01:58
רויטל ונונו,1085542,בלבול בווטסאפ: למה אתם לא מצליחים לשלוח איש קשר?,2986,30/09/2025 00:55
רויטל ונונו,1085541,שנתיים אחרי שעזבו את הארץ: פאולה וליאון רוזנברג עוברים למיקום חדש,35735,30/09/2025 00:27
יהודה רוזן,1085540,מהפכה שקטה בבנייה: התקנות החדשות כבר על השולחן,445,29/09/2025 23:50
רויטל ונונו,1085539,"כתבת חדשות 12 על תוכנית טראמפ: ""צריך תוכנית שהצד השני יסכים לה""",541,29/09/2025 23:47
יהודה רוזן,1085538,"וול סטריט ננעלה בעליות: הזהב מזנק, הנפט מתרסק",422,29/09/2025 23:34
יהונתן פרי,1085536,"מנכ""ל חדש לענקית הסייבר הישראלית: ""נרגש לשלב הבא""",437,29/09/2025 23:00
ירון שמאי,1085537,"רוברט קיוסאקי: ""תשקיעו בזה 100 דולר – ותקבלו 500 תוך שנה""",39793,29/09/2025 22:58
יהונתן פרי,1085535,"ענקית האנרגיה הישראלית בהסכם אדיר באירופה: ""מבסס את מעמדנו""",375,29/09/2025 22:32
יהונתן פרי,1085534,"דרור קליר חושש: ""משלמים כסף כדי לפגוע בי""",930,29/09/2025 22:11
ירון שמאי,1085533,"רוני מאנה מבטיח: ""ביבי יובס בבחירות, לקקני ערוץ 14 יחפשו עבודה""",3697,29/09/2025 22:08
יהונתן פרי,1085531,אייל ברקוביץ' בדרך החוצה: זו הסערה שמטלטלת את עולם התקשורת,30837,29/09/2025 21:46
אפרת בבג'ני,1085527,"טראמפ: ""יום היסטורי לשלום"". נתניהו: ""תומך בתוכנית לסיום המלחמה""",389,29/09/2025 21:19
אפרת בבג'ני,1085530,בנק דיסקונט בתחזית מפתיעה: זה מה שיקרה לריבית בנק ישראל ב-2026,562,29/09/2025 21:07
רוי שיינמן,1085429,"הבנק האמריקאי בהמלצה מפתיעה: המניה ""המשעממת"" שכדאי לקנות",460,29/09/2025 21:06
כפיר אדר,1085485,כוכבת האח הגדול נפרדת בכאב אחרי טרגדיה גדולה: ''בלב שבור'',489,29/09/2025 21:03
יהונתן פרי,1085529,"משפחת אקרשטיין הכריעה: זה המנכ""ל החדש של הקבוצה ",1077,29/09/2025 20:54
יהודה רוזן,1085528,מרכז מסחרי חדש בסמוך לכור בדימונה - מי הרוכשת המפתיעה?,362,29/09/2025 20:49
כפיר אדר,1085484,"כוכב הפטריוטים הותקף באלימות ברחוב: ""מכרת את נשמתך לערוץ 14""",549,29/09/2025 20:47
יהונתן פרי,1085526,"יאיר גולן מגיב לראשונה על התנצלות נתניהו: ""משת""פ של חמאס וקטאר""",820,29/09/2025 20:42
אפרת בבג'ני,1085525,"חברת PHI מציגה שינויים בצמרת: זה המנכ""ל החדש",537,29/09/2025 20:35
איציק יצחקי,1085472,"נגיד בנק ישראל בראיון: ""משק אוטרקי? שמח שנתניהו חזר בו""",486,29/09/2025 20:20
יהונתן פרי,1085524,"ליהיא גרינר נגד ה-MeToo: ""הכל זה הטרדה. WTF""",218,29/09/2025 20:18
ירון שמאי,1085522,רשת הפיצריות המפורסמת נמכרת במיליוני שקלים – ותשלש את סניפיה,1288,29/09/2025 20:13
אפרת בבג'ני,1085523,נתניהו שוחח עם ראש ממשלת קטאר: התנצל על התקיפה הישראלית בדוחא,234,29/09/2025 20:09
יהודה רוזן,1085521,הנתונים שחושפים מי באמת מסתבך בחובות בישראל,333,29/09/2025 20:08
יהונתן פרי,1085520,"מאור ברוכמן במהלך ציני - מבקשת סליחה מדיירי ""האח הגדול""",582,29/09/2025 19:54
אפרת בבג'ני,1085519,"מלי לוי מתחזקת בדת? ""אני מרגישה את השכינה ככוח שמרים אותי""",322,29/09/2025 19:45
יהונתן פרי,1085518,עולם הכדורגל בתדהמה: זה השינוי שיחסוך מיליוני דולרים?,627,29/09/2025 19:42
כפיר אדר,1085512,"שרון גל בתביעת ענק: ממי הוא דורש 350,000 שקל פיצוי?",964,29/09/2025 19:33
אפרת בבג'ני,1085517,"כוכבת ""האח הגדול"" מותקפת: ""אין לי מושג איך לעצור את זה""",661,29/09/2025 19:18
כפיר אדר,1085514,"עצומה נגד שידור הסדרה של קשת 12: ""ניתוק והתמסחרות, לא יעברו בשתיקה''",3306,29/09/2025 19:11
כפיר אדר,1085470,אברי גלעד בהצעה מפתיעה: ''אני מעוניין שהם יטבעו בים'',625,29/09/2025 19:03
יהונתן פרי,1085516,ארז איסקוב לא עוצר: זה הפרויקט שיוצא לדרך בהובלתו,1039,29/09/2025 18:53
אפרת בבג'ני,1085515,אושר - תקרת הגירעון תועלה ל-5.2%: זה הסכום שיועבר למשרד הביטחון,236,29/09/2025 18:45
כפיר אדר,1085478,אחרי 8 שנים: אחת המסעדות האהובות והייחודיות בישראל נסגרת,17687,29/09/2025 18:44
צוף צימרינג,1085502,הכוכב הבא של ישראל? ריאליטי מוזיקה ראשון בחברה הערבית,441,29/09/2025 18:40
יהונתן פרי,1085513,מקרה מזעזע במרכז הארץ: מנהל חשוד שהטריד מינית 4 קטינים,457,29/09/2025 18:30
אפרת בבג'ני,1085511,"סיכום המסחר בבורסה: ירידות במדדים, אלו המניות שצנחו ביותר מ-4%",380,29/09/2025 18:18
רעי שני,1085476,ענקית הרכב קורסת בחובות של מיליארדים: תכריז על פשיטת רגל,835,29/09/2025 18:14
יהונתן פרי,1085510,נהגי המוניות בצעד חסר תקדים: כך ילחמו באובר ובמירי רגב,457,29/09/2025 18:07
אפרת בבג'ני,1085509,נטפליקס סופגת מכה: טראמפ יטיל מכס של 100% על סרטים זרים,295,29/09/2025 17:56
כפיר אדר,1085477,המסעדה האהובה נסגרת מיידית: ''עלולים להיות מעורבים באירועים ביטחוניים'',229,29/09/2025 17:51
כפיר אדר,1085466,הקלה חדשה לנהגים בישראל: זו המהפכה שמתוכננת בטסטים,446,29/09/2025 17:44
אפרת בבג'ני,1085507,"ינון מגל מסתבך? ""קרא להפעיל אלימות נגדנו, נגיש תביעה""",688,29/09/2025 17:34
יהונתן פרי,1085508,"תרצה כהן לא נחה: זה המהלך המשמעותי שלה אחרי ""האח הגדול""",1915,29/09/2025 17:33
צוף צימרינג,1085505,הישג בינלאומי ליוניברסל מיוזיק פאבלישינג ישראל: זו הסיבה,267,29/09/2025 17:23
כפיר אדר,1085464,הסוף לבעיות החיבור לאינטרנט בכביש? זה השדרוג שעומד להכנס,358,29/09/2025 17:22
יהודה לוינגר,1085500,הקרב החם בטלוויזיה כבר בקרוב: סלקום TV+ יוצא לדרך - וככה זה נראה,1211,29/09/2025 17:09
יהונתן פרי,1085503,"איתות בבית הלבן: ""קרובים מאוד לעסקה. דיברנו ישירות עם חמאס""",195,29/09/2025 17:09
כפיר אדר,1085504,תקלת ענק בנתב''ג: חברות התעופה מדווחות על עומס ועיכובים,8167,29/09/2025 17:05
כפיר אדר,1085462,שדרות רוקח נסגרת הרמטית לתנועה: זה מה שיקרה ב-16.10,355,29/09/2025 16:55
אפרת בבג'ני,1085499,"סערת ריבית בנק ישראל: ""ההחלטה מאכזבת, מקשה על רוכשי הדירות""",807,29/09/2025 16:32
איציק יצחקי,1085501," מנכ""ל בנק לאומי: ""ריבית הפריים תישאר מופחתת ב-0.25%, נעזור ללקוחות""",356,29/09/2025 16:30
יהונתן פרי,1085498,זה סופי: Electronic Arts עוברת לבעלות ערבית תמורת 55 מיליארד דולר,403,29/09/2025 16:29
רוי שיינמן,1085494,בנק ישראל חותך את התחזיות - זו הצמיחה הצפויה במשק השנה,366,29/09/2025 16:25
איציק יצחקי,1085495,"משקיעי הנדל""ן קנו דירות בשכונה הזאת - עכשיו הם ירוויחו",366,29/09/2025 16:20
אפרת בבג'ני,1085496,חשוב דויטשה בנק,0,29/09/2025 16:18
כפיר אדר,1085460,הראל ויזל מתרחב לעיר חדשה: איפה יוקם השייק שאק החדש?,576,29/09/2025 16:16
אפרת בבג'ני,1085491,"שרה נתניהו סופגת עקיצה בשידור חי: ""התמוטטות אייקונית""",8025,29/09/2025 16:12
כפיר אדר,1085405,הזמר האהוב בווידוי מפתיע: ''התגרשתי ואחרי 5 שנים התחתנו שוב'',1075,29/09/2025 16:09
צוף צימרינג,1085493,"""הגברת הראשונה"" של כאן יוקרן ב""Cologne Film Festival"" בגרמניה",223,29/09/2025 16:09
יהונתן פרי,1085492,בפעם השנייה ברציפות: טיקטוק וליגת ווינר סל בשיתוף פעולה אדיר,282,29/09/2025 16:06
צוף צימרינג,1085490,"הכוכבת הבינלאומית תגיע לישראל: ""7 באוקטובר יהיה יום של זיכרון עמוק""",918,29/09/2025 15:51
רוי שיינמן,1085467,בנק ישראל בהחלטה דרמטית: הריבית שוב לא יורדת בפעם ה-14 ברציפות,488,29/09/2025 15:51
יהונתן פרי,1085487,הקריפטו היומי: ביטקוין חוזר לעלות; זה המטבע שקפץ מעל אלף דולר,394,29/09/2025 15:50
כפיר אדר,1085393,בהלה בטיסה לישראל: הנוסע איבד הכרה ואז התחילה הדרמה,612,29/09/2025 15:48
אפרת בבג'ני,1085488,מגי טביבי וערוץ 14 חוגגים: זה ההישג האדיר של מגישת החדשות,2584,29/09/2025 15:36
ענת סימן טוב,1085483,מחפשים טיסה זולה? כך תטוסו בפחות מ-350 שקל,402,29/09/2025 15:35
צוף צימרינג,1085489,,0,29/09/2025 15:31
צוף צימרינג,1085486,לאחר חשיפת ice: עדן חסון משתף על העבודה סביב הקריירה הבינלאומית,247,29/09/2025 15:27
כפיר אדר,1085457,יותר קנסות ויותר דוח''ות: איפה הנהגים מסתבכים בגדול?,280,29/09/2025 15:11
אפרת בבג'ני,1085482,חברת הדיפטק הישראלית חוגגת: השלימה גיוס בסך של 12 מיליון דולר,569,29/09/2025 15:02
רונן זכאי,1085481,"אנלייט הישראלית בעסקת ענק בסך 340 מיליון דולר, המניה עולה",0,29/09/2025 14:46
טל גורן,1085475,שני אחים גנבו נכסים דיגיטליים בשווי 8 מיליארד דולר: זה העונש שיקבלו,524,29/09/2025 14:40
יהודה לוינגר,1085463,בגיל 54: דודו אוטמזגין חוגג הישג היסטורי לראשונה בחייו,1954,29/09/2025 14:38
צוף צימרינג,1085451,שון יפישין משתף על אלה לי להב וחושף: האם הם בזוגיות? | ראיון,625,29/09/2025 14:28
רוי שיינמן,1085459,טראמפ מטיס את מניות הקנאביס - אלו המניות שמזנקות,408,29/09/2025 14:25
הדר הראל,1085474,לא רק ביטקוין: המהלך הרגולטורי שעשוי להזניק את הדור הבא של המטבעות,370,29/09/2025 14:21
הדר הראל,1085471,האדם נגד המכונה: מי באמת מנהל את שוק המניות עכשיו?,271,29/09/2025 14:13
טל גורן,1085473,מהפכה בסל החיסונים בישראל: זה החיסון שיפחית את התחלואה ב-80%,466,29/09/2025 14:11
איציק יצחקי,1085259,כמה עולה לשכור משרד בתל אביב? הנתונים המלאים נחשפים,443,29/09/2025 14:01
כפיר אדר,1085469,"רמי לוי מחזיר את המוצר האהוב בחזרה למדפים: ''חדשות טובות""",34589,29/09/2025 13:59
רעי שני,1085468,"גל פיטורים בחברת הענק: 4,000 עובדים יילכו הביתה",990,29/09/2025 13:56
טל גורן,1085465,אהוד יערי זרק פצצה באולפן חדשות 12: האם עמד בהבטחה?,7161,29/09/2025 13:54
הדר הראל,1085461,יום הלב הבינלאומי: הצעדים הפשוטים שיצילו את הלב שלכם,1045,29/09/2025 13:26
ענת סימן טוב,1085452,הנתונים המדאיגים נחשפים: בתי המלון בישראל חווים ירידה חדה,450,29/09/2025 13:24
כפיר אדר,1085458,חניון רובוטי ראשון בישראל: זו העיר בה הוא פועל ולא ידעתם,797,29/09/2025 13:23
כפיר אדר,1085454,בפעם הראשונה אי פעם: זו העיר שתעבור פרויקט התחדשות עירונית,300,29/09/2025 13:15
רוי שיינמן,1085422,"וורן באפט מזהיר אתכם: ""אתם משחקים באש""",368,29/09/2025 13:12
טל גורן,1085456,"משרד הבריאות באזהרה חריגה: ""לפנות בדחיפות ללשכת הבריאות""",256,29/09/2025 13:12
כפיר אדר,1085411,נתב''ג משבית את הפעילות: זה מה שיקרה ב-1.10,1005,29/09/2025 13:11
רעי שני,1085455,שופרסל שוברת את השוק: מרסקת מחירים של עשרות מוצרים,17552,29/09/2025 13:08
רונן זכאי,1085453,השחקן המוכר מבזבז אלפי יורו ביום: זו הסיבה  טום הולנד מסתבך עם המעריצים: הצעד החריג שהוביל להוצאות של אלפי יורו,0,29/09/2025 13:01
כפיר אדר,1085400,אלירז שדה חוגג יום מאושר: ''גם כשאני לידך אני מתגעגע'',503,29/09/2025 12:54
רעי שני,1085448,"ממשלות השמאל בעולם מנסות לסגור על ישראל, הן לא תצלחנה! | פרופ' ירון זליכה",1453,29/09/2025 12:53
טל גורן,1085450,מהפכה במגרשי הספורט בישראל: כך הם יהפכו להשקעה מניבה,267,29/09/2025 12:48
טל גורן,1085449,"כתבת חדשות 12 במתקפה חריפה: ""ערוץ הסתה, הרעל מחלחל""",2128,29/09/2025 12:28
רעי שני,1085440,טלטלה בשוק המוניות בישראל: זו הסיבה לירידה הדרמטית במחירים,11804,29/09/2025 12:12
טל גורן,1085439,"בדרך להפסקת אש בעזה: הפערים בין טראמפ לנתניהו צומצמו, זו דרישת חמאס",374,29/09/2025 12:10
טל גורן,1085445,"כוכב האח הגדול מתפרק: ""שואל את עצמי מתי תבוא הזוגיות שאני רוצה?""",346,29/09/2025 12:09
רוי שיינמן,1085420,הבורסה הסינית בשיא - כדאי להשקיע או מאוחר מדי?,237,29/09/2025 12:06
יהודה לוינגר,1085441,בנק הפועלים נפרד: מנהל הדיגיטל עוזב לאחר שבעה חודשים בלבד,1262,29/09/2025 12:04
צוף צימרינג,1085444,"גלעד פרץ מ""האח הגדול"" חושף כי הוא מחפש זוגיות ומציע אייפון | צפו",358,29/09/2025 11:56
ענת סימן טוב,1085361,"מנכ""ל SCOOP: ""עברתי מסלול חיים לא פשוט""",870,29/09/2025 11:56
הדר הראל,1085442," התקף חרדה: איך מזהים אותו, ומה אפשר לעשות כשזה קורה",74,29/09/2025 11:50
כפיר אדר,1085434,הזוכים ב-17 מיליון שקל בלוטו נחשפים: ''חושב על שינוי מקצועי'',1226,29/09/2025 11:42
כפיר אדר,1085398,רמי לוי וישראייר בבשורה לטסים: זה מה שיקרה מה-19.10 בנתב''ג,272,29/09/2025 11:42
הדר הראל,1085431, 4 סודות מפתיעים שמדענים גילו כעת בכוס הבירה והיין שלכם,300,29/09/2025 11:28
טל גורן,1085437,רשת מלונות פתאל מרעננת את השורות: זו הבכירה שמצטרפת לקבוצה,533,29/09/2025 11:24
כפיר אדר,1085438,הבורסה בהתלהבות: המלחמה תופסק? המדדים כבר מרגישים את זה,247,29/09/2025 11:23
רעי שני,1085436,זארה שוקלת לעזוב את ישראל? זו ההחלטה שקיבלה הרשת,4604,29/09/2025 11:22
צוף צימרינג,1085435,ישראל תשתתף באירוויזיון? תאגיד השידור הציבורי וקשת משתפים פעולה,238,29/09/2025 11:15
טל גורן,1085430,הנהלת הסופרבול החליטה: זה כוכב הענק שיופיע במחצית המשחק היוקרתי,173,29/09/2025 11:09
רוי שיינמן,1085425,"זינוק של 1,700% - כך עשתה המניה הישראלית מהפך חלומי",4644,29/09/2025 11:06
רונן זכאי,1085433,"בגיל 36: הזמר הישראלי מרחיב את המשפחה ""ברוכה הבאה""",0,29/09/2025 11:02
כפיר אדר,1085432,כניסת וצאת יום כיפור: מתי נכנס הצום ומה מזג האוויר?,1016,29/09/2025 11:00
רעי שני,1085426,"דרמה בנתב""ג: החשוד בירי והשלכת רימון על השווארמה המפורסמת נעצר",578,29/09/2025 10:52
טל גורן,1085428,עם שוק עולמי בשווי 20 מיליארד דולר: זו החברה שנבחרה לנציגה הרשמית בישראל,243,29/09/2025 10:48
צוף צימרינג,1085427,טיילור מלכוב מגיבה לסרט על הדרמה בחייה. והאם התקבל צו איסור פרסום?,1194,29/09/2025 10:42
איציק יצחקי,1085424,"החרם נגד ישראל מגיע גם לענף הנדל""ן: ""הפכנו למטרה""",1433,29/09/2025 10:30
צוף צימרינג,1085423,"הנשיא יצחק הרצוג על סערת האירוויזיון: ""מהלך שנועד להחליש""",231,29/09/2025 10:23
טל גורן,1085421,הכוכב הישראלי ייעדר ממשחקה של קבוצתו: זו הסיבה לכך,784,29/09/2025 10:09
כפיר אדר,1085383,"אופירה אסייג מבקשת את עזרת הציבור: תשיג 400,000 שקל?",8303,29/09/2025 09:59
טל גורן,1085419,"בן כספית מתפוצץ: ""זו תועבה שאין לתאר, סדום ועמורה""",749,29/09/2025 09:54
רעי שני,1085418,ישראל היום במינוי מסקרן: זו הכתבת החדשה שמצטרפת,673,29/09/2025 09:53
צוף צימרינג,1085416,ארז איסקוב חוגג: זו הבחורה החדשה בחייו? | צפו,3288,29/09/2025 09:46
איציק יצחקי,1085382,דירה בהנחה של מיליון שקל: אלו הערים החדשות שמצטרפות,840,29/09/2025 09:42
רעי שני,1085417,סופר פארם עושה מהפכה בסניפים: זה המותג החדש שנפתח כחנות עצמאית,394,29/09/2025 09:42
טל גורן,1085414,גאולה אבן סער בדרך לתפקיד חדש: תקבל את הרצועה היוקרתית?,737,29/09/2025 09:41
צוף צימרינג,1085413,שרה נתניהו בביקור אצל הרבי: זו הדרמה עם משפחות החטופים,655,29/09/2025 09:38
רעי שני,1085399,הרצח שמזעזע את העולם: שלוש צעירות עונו למוות בשידור חי,11359,29/09/2025 09:38
רעי שני,1085415,בכ-58 מיליון שקל: זו החברה שרכשה את מגדל הענק בחיפה,316,29/09/2025 09:33
טל גורן,1085412,"הרצוג בעקיצה לנתניהו: ""לתפקד כמדינה מתוקנת זה להיות חלק ממשפחת העמים""",433,29/09/2025 09:23
רוי שיינמן,1085409,הדולר צונח ב-1.4% ומתקרב לשפל שנתי - זה מה שמושך אותו למטה,10029,29/09/2025 09:22
ענת סימן טוב,1085356,עדכוני תעופה: אלו החברות שחזרו לישראל ואלו שעדיין לא  ,380,29/09/2025 09:12
טל גורן,1085407,"ה-WWE גורם לשערורייה: ""אתם יודעים היטב מה קרה ב-7.10.23""",333,29/09/2025 09:09
כפיר אדר,1085386,מגישת חדשות 13 המפוטרת חוטפת: ''שרה הלל לפשעי מלחמה'',918,29/09/2025 09:08
כפיר אדר,1085408,"רייטינג: מאסטר שף לא עוצרת, ינון מגל והפטריוטים בהישג חריג",2594,29/09/2025 09:08
רעי שני,1085410,אלביט מערכות בעסקת ענק: זה מה שתמכור תמורת כ-400 מיליון שקל,544,29/09/2025 09:05
טל גורן,1085406,התעשייה האווירית חוטפת קנס בשווי 825 אלף שקלים: הסיבה נחשפת,309,29/09/2025 08:46
כפיר אדר,1085403,משקיעים בחברה הזו? דיבידנד 12 ברציפות בדרך אליכם,468,29/09/2025 08:39
כפיר אדר,1085396,"העוקץ החכם בישראל: איך 300 אלף מצטמק ל""רק"" 45,000 שקל?",235,29/09/2025 08:39
רעי שני,1085395,איש העסקים ברח מישראל: חשוד בהונאת מאות משקיעים בסכומי עתק,447,29/09/2025 08:38
איציק יצחקי,1085404,"טלטלה בשוק הנדל""ן: המדינה שללה רישיון משתי חברות קבלניות ",987,29/09/2025 08:38
רוי שיינמן,1085394,"מניית השבבים ""הסודית"" שמפגרת מאחור, והאם היא יכולה לזנק?",286,29/09/2025 08:31
טל גורן,1085402,"יותר מ-1,500 סטודנטים בפנייה דחופה לנתניהו: ""עצור את חקיקת חוק ההשתמטות""",350,29/09/2025 08:29
טל גורן,1085397,סכנה ביעד האהוב: שדות תעופה נסגרו ויותר מ-30 אלף תושבים פונו מבתיהם,384,29/09/2025 08:16
טל גורן,1085392,"איתמר בן גביר חוטף מכה קשה: מח""ש חקרה שניים ממקורביו",424,29/09/2025 07:52
כפיר אדר,1085385,רותם אבוהב חוששת? ''חשבתי שזה מקצוע שנכחד'',327,29/09/2025 07:51
רעי שני,1085391,בתו של דן מרידור ברכישת ענק: אקזיט לסטארטאפ הישראלי,13777,29/09/2025 07:47
טל גורן,1085390,"משפחות החטופים הפגינו מול בניין האו""ם: ""אנחנו לא מאבדים תקווה""",205,29/09/2025 07:39
רוי שיינמן,1085389,לקראת פתיחת המסחר: מה צפוי היום והאם תהיה הורדת ריבית?,413,29/09/2025 07:38
כפיר אדר,1085387,שופרסל ורשת הסטוק שלה בדרך לבית המשפט? הסכסוך הגדול נחשף,811,29/09/2025 07:27
טל גורן,1085388,"מזרח תיכון חדש? טראמפ: ""יש לנו סיכוי לגדולה בפעם הראשונה אי פעם""",262,29/09/2025 07:17
כפיר אדר,1085384,בלגן בחברת הביטוח: חשדות למעילה במיליונים בתביעות מזויפות ,9276,29/09/2025 07:00
כפיר אדר,1085381,אייל גולן חושף את שם התינוק החדש: ''וייקרא שמו בישראל'',20843,29/09/2025 07:00
רעי שני,1085277,בנק ישראל יוריד את הריבית? זה מה שצפוי לקרות היום,408,29/09/2025 06:40
ענת סימן טוב,1085355,"רמי לוי, ויקטורי או יוחננוף: זו רשת המזון הזולה השבוע",270,29/09/2025 06:20
אפרת בבג'ני,1085359,המדריך המלא ליום כיפור: עצות לתזונה נכונה לפני ואחרי הצום,328,29/09/2025 06:20
איציק יצחקי,1085175,בכמה זמן בונים דירה בישראל? הנתון שחושף דרמה בשוק הדיור,583,29/09/2025 06:00
כפיר אדר,1085379,דנה וייס מדהימה את צופי חדשות 12: כך עלתה לשידור,1408,29/09/2025 06:00
כפיר אדר,1085380,איילה חסון מאוימת: ''מגיע לפוצץ לך את הצורה'',588,29/09/2025 06:00
כפיר אדר,1085378,מהרו לתדלק: כמה כסף תחסכו אם תעשו זאת עד ה-1.10?,483,29/09/2025 05:30
כפיר אדר,1085377,רמי לוי מגיב לגניבת העגלות: זו העיר שתקבל עגלות חדשות,6085,29/09/2025 05:25
כפיר אדר,1085376,"ביטוח לאומי יחלק מענק של 649 ועד 1,200 שקל: מי הזכאים?",9658,29/09/2025 05:20
רויטל ונונו,1085375,"הונאה זדונית בביט עשויה לסכן גם אתכם: ""נעלם הכסף"" ",640,29/09/2025 04:09
רויטל ונונו,1085374,"בתו של המוזיקאי המפורסם נעדרת: ""עזרו לנו למצוא אותה""",1483,29/09/2025 03:34
רויטל ונונו,1085373,"כוכב הפטריוטים עבר תקיפה: ""מישהו עצר לידי והכניס לי מכה""",528,29/09/2025 02:45
יהודה רוזן,1085372,המהלך הדרמטי שיכול להפוך את ווישור לענקית ביטוח,539,29/09/2025 02:40
יהודה רוזן,1085371,"נטעלי שם טוב מגיבה להחלטה הדרמטית: ""לעשות צדק לעצמי""",499,29/09/2025 02:13
יהודה רוזן,1085370,"השב""כ חשף: בתו של השר בן גביר ניצלה ממלכודת איראנית - ""קו ישיר""",472,29/09/2025 01:59
יהודה רוזן,1085369,"וול סטריט בהלם: ""הכוכב הפיננסי"" נעצר והסודות האפלים נחשפים ",395,29/09/2025 01:45
