שם,מספר כתבה,כותרת,צפיות,תאריך יצירה
דויד ויצמן,1080714,אריק מננדז לא יזכה לחנינה: אלה הסיבות שהביאו להחלטה,597,22/08/2025 09:31
רעי שני,1080716,"ברק אברמוב חושף את השקעת הענק: ""מעל 60 מיליון שקל""",2873,22/08/2025 09:20
דויד ויצמן,1080717,מאסק נחשף: לא תאמינו את מי ניסה לגייס במטרה להשתלט על OpenAI,564,22/08/2025 09:13
דויד ויצמן,1080709,אנת'רופיק לא עוצרת: מגייסת סכום עתק של 10 מיליארד דולר,403,22/08/2025 09:07
ירון שמאי,1080718,דיווח: החברה שהזרימה כספים מקטאר למקורבי נתניהו – הרוויחה מיליונים,405,22/08/2025 09:06
רוי שיינמן,1080619,שיגעון הלבובו נמשך: תכניס השנה מיליארד דולר?,612,22/08/2025 09:00
דויד ויצמן,1080710,הזוי: הזמר המפורסם הסתובב ללא לבוש בלילה תוך כדי ריקוד - ונעצר,494,22/08/2025 08:58
ירון שמאי,1080715,"כוכב 'לשחרר את שולי' מבקש סיוע: ""הסתבכתי שוב פעם""",922,22/08/2025 08:31
רעי שני,1080713,בושה: פארק שעשועים סירב להכניס 150 ילדים ישראלים,575,22/08/2025 08:23
רעי שני,1080712,"ערוץ 14 יפסיד מאות אלפי שקלים? ""שימוש ציני בכספי הציבור""",525,22/08/2025 08:02
אפרת בבג'ני,1080678,"אגם בוחבוט מככבת, אייל ברקוביץ' בקמפיין חדש | דירוג הפרסומות הטובות",689,22/08/2025 07:59
ירון שמאי,1080711,"הכלכלן הבכיר בבנק העולמי מאשים את ישראל ברצח עם: ""לפטר אותו""",227,22/08/2025 07:57
אפרת קרסנר,1080653,מירי רגב או טלי גוטליב? זו הפוליטיקאית החזקה בישראל,931,22/08/2025 07:36
כפיר אדר,1080706,מאור בוזגלו ומירן בוזגלו נפרדים מישראל: ''אפשר לקפל'',1374,22/08/2025 07:00
כפיר אדר,1080707,רמי לוי מרסק את השוק: זה המוצר שתקנו ב-30% פחות,1970,22/08/2025 07:00
אפרת בבג'ני,1080693,יוליוס בר בתחזית מפתיעה: הורדת הריבית הבאה תתרחש בחודש הזה,357,22/08/2025 06:40
איציק יצחקי,1080530,דירה בהנחה מציגה את השקר הגדול; רשות המסים נגד המשקיעים,2046,22/08/2025 06:37
כפיר אדר,1080705,אברי גלעד מודה: ''לא מעניין היום אף אחד'',710,22/08/2025 06:33
רפאל בן זקרי,1080565,האייפון בעדכון משמעותי: אלה החידושים שיגיעו אליכם בקרוב,1118,22/08/2025 06:21
רפאל בן זקרי,1080646,סמארטפון יוקרתי בחצי מחיר? בדקנו אם ה-POCO F7 עומד בציפיות,613,22/08/2025 06:20
דויד ויצמן,1080681,הבועה מתפוצצת: מדוע 95% מההשקעות ב-AI נכשלות? ,429,22/08/2025 06:20
כפיר אדר,1080704,"סקר מנדטים משוגע: גנץ עומד להיעלם, בנט מביך את נתניהו",1522,22/08/2025 06:17
כפיר אדר,1080703,הראל ויזל לא עוצר: זה הכיוון אליו הוא לוקח את פוקס,536,22/08/2025 06:11
ענת סימן טוב,1080624,"מנכ""ל תיקי מודן: ""שוק החזרה לבית הספר מגלגל כ-450 מיליון שקל""",581,22/08/2025 06:02
דויד ויצמן,1080652,שלמה החזקות מדווחת: עלייה של 38% ברווח הנקי לכ־160 מיליון שקל,352,22/08/2025 06:02
ענת סימן טוב,1080633,"רמי לוי, שופרסל או קרפור? סל השישי הזול ביותר",503,22/08/2025 06:01
כפיר אדר,1080702,"כוכב הפטריוטים נפרד מהמסך: ''ידאגו לכם, מבטיח''",1014,22/08/2025 05:58
כפיר אדר,1080701,ביטוח לאומי מחלק מענקים למיליוני ישראלים: מה תקבלו ב-12.9?,816,22/08/2025 05:52
רויטל ונונו,1080700,"כוכב ""קופה ראשית"": ""אשתי סיפרה שהיא בגדה בי והילד לא ממני""",1002,22/08/2025 03:51
רויטל ונונו,1080699,"ליהיא גרינר חושפת את סוד ההרזיה שלה: ""אני לא שומרת על התזונה""",706,22/08/2025 03:06
רויטל ונונו,1080698,בית הדין הרבני: בעל שנחר ישלם לאשתו 130 אלף שקל כפיצוי ,470,22/08/2025 02:26
רויטל ונונו,1080697,"דן מרגלית בראיון אחרון: ""אמרו לי 'אתה חולה מאוד'""",8973,22/08/2025 01:53
רויטל ונונו,1080696,"אברי גלעד: ""העסקה הזאת היא בין הגרועות שיש בעולם""",618,22/08/2025 01:16
רויטל ונונו,1080695,"עמוס לוזון תוקף: ""האפס מאופסת הזאת מנסה לסחוט אותי""",16094,22/08/2025 00:13
ירון שמאי,1080694,רשת החנויות שפשטה רגל עושה קאמבק: פותחת סניפים מחדש,1165,21/08/2025 23:04
ירון שמאי,1080692,"המורה מפרשת המין בפ""ת מסתבכת? ""נקטה באלימות כלפי תלמידים""",821,21/08/2025 22:39
אפרת בבג'ני,1080691,"שי לי עפרי חושפת: ""הייתי צריכה לפרנס בית שלם""",15597,21/08/2025 22:36
דויד ויצמן,1080689,משרד האנרגיה אישר: מאגר לוויתן יפותח במימדים עצומים,402,21/08/2025 22:32
אפרת בבג'ני,1080688,"סקר מנדטים דרמטי: נתניהו חוגג הישג ענק, בני גנץ מתרסק ",4108,21/08/2025 22:14
ירון שמאי,1080690,"הפתעה בנתב""ג: אחרי עשור – זו חברת התעופה שחוזרת לישראל",2605,21/08/2025 22:02
דויד ויצמן,1080686,"מפקד יהל""ם המיועד פרש במפתיע לפני קבלת המינוי",296,21/08/2025 21:39
דויד ויצמן,1080673,"סיון כהן לח""כ מהימין בשידור חי: ""אל תשקר, אתה לא בקיא?""",392,21/08/2025 21:35
דויד ויצמן,1080683,טראמפ יכול לחגוג: הניצחון שרשם הנשיא בבית המשפט,356,21/08/2025 21:28
יוסף דולגופולסקי,1080684,מיליארד דולר ביממה: מי הזמר האנטישמי שהשיק מטבע קריפטו?,517,21/08/2025 21:25
דויד ויצמן,1080677,"שיא לשנה בגיוס אג""ח קונצרני, מגמה חיובית בבורסה בת""א ",311,21/08/2025 21:18
ירון שמאי,1080685,"משרד הבריאות: ""המחלה הזו מתפשטת - הציבור נדרש להתמגן""",425,21/08/2025 20:57
אפרת בבג'ני,1080682,צ'יקו מיקו קרואסון הפכו לסנסציה: תופעת הרשת החדשה של נתניה,1112,21/08/2025 20:57
דויד ויצמן,1080662,"חברות הסלולר עתרו לבג""צ נגד משרד התקשורת: זו הסיבה ",511,21/08/2025 20:35
דויד ויצמן,1080634,"שבא תחלק דיבידנד בגובה 30 מיליון שקל, רבעון שני ברציפות",264,21/08/2025 20:31
אפרת בבג'ני,1080680,חברת ברקת מציגה שינויים בצמרת: אלו שלושת המנהלים החדשים,884,21/08/2025 20:03
ירון שמאי,1080679,בשורה למחזיקי הרב קו: זה הפיצוי שתקבלו על השיבושים בתחבורה,622,21/08/2025 19:58
אפרת בבג'ני,1080674,"מגיש חדשות 12 נפרד מישראל: ""דאגתי למחליף""",1702,21/08/2025 19:04
יהודה רוזן,1080676,"נסרין קדרי לא מתפתה לכסף הגדול: ""לכבס את הכביסה המלוכלכת""",980,21/08/2025 19:01
יהודה רוזן,1080675,תוך פחות משנה: הסטארט אפ הישראלי נמכר במאות מיליונים,1586,21/08/2025 18:55
הדר הראל,1080671,"רכבת ישראל קורסת ומירי רגב מאשימה: ""בגלל הקפלניסטים האוטובוסים לא מגיעים""",552,21/08/2025 18:49
אפרת בבג'ני,1080672,רשת 13 בחשיפה דרמטית: האמת המרה על עסקאות החטופים,734,21/08/2025 18:34
דויד ויצמן,1080669,נאו־נאצי שינה את זהותו המינית - כדי להיות בכלא נשים,328,21/08/2025 18:33
יהודה לוינגר,1080659,דרמה ברשת 13: הדובר עידן ארזי עוזב במפתיע לאחר 4 שנים,846,21/08/2025 18:22
אפרת בבג'ני,1080666,"סיכום המסחר: חברות הביטוח מזנקות, זו המניה שצמחה ביותר מ-11%",378,21/08/2025 18:14
רפאל בן זקרי,1080668,אירוע ההשקה של גוגל: מופע נוצץ או חידושים אמיתיים?,333,21/08/2025 17:56
דויד ויצמן,1080667,"מירי רגב מצאה את הסיבה לפקקים - היועמש""ית; ומתי התחנות יחזרו לפעול? ",540,21/08/2025 17:52
רעי שני,1080664,"הזמרת המפורסמת קוראת לחרם כלכלי על ישראל: ""להפסיק את רצח העם""",595,21/08/2025 17:52
אפרת בבג'ני,1080665,"מגיש רשת 13 קיבל הודעה מפתיעה: ""הגיע הזמן להיפרד""",510,21/08/2025 17:34
רעי שני,1080663,"גיא פלג הובך בשידור חי: ""ראיתי אותך עם גל גדות""",502,21/08/2025 17:25
אפרת בבג'ני,1080661,"פרודתו של שולי רנד כואבת: ""נפגעתי, אלו דמעות של פחד וחרדה""",582,21/08/2025 17:15
רעי שני,1080657,ארדואן מנחית מכה נוספת על הכלכלה הישראלית: טורקיה בצעד דרמטי,3115,21/08/2025 17:15
יהודה רוזן,1080660,מהפכה משמעותית: טכנולוגיה פורצת דרך מבטיחה לאבחן אוטיזם מהבית,333,21/08/2025 17:15
איציק יצחקי,1080654,"כמה מרוויח מנכ""ל שיכון ובינוי ולמה אושרו לו הטבות נוספות?",521,21/08/2025 17:15
יהודה רוזן,1080656,הקרן הישראלית סגרה עסקת ענק עם מותג ההלבשה החזק בעולם,945,21/08/2025 17:03
רעי שני,1080655,טסים לתאילנד? המדינה מחלקת מאות אלפי כרטיסי טיסה בחינם לתיירים,444,21/08/2025 17:02
אפרת בבג'ני,1080650,אנבידיה תגיע לשווי של 9 טריליון דולר? זו התחזית של האנליסט הבכיר,491,21/08/2025 16:45
דויד ויצמן,1080638,בדרך לחופש? האחים שרצחו את הוריהם יבקשו חנינה,348,21/08/2025 16:41
אפרת קרסנר,1080651,גולסטאר באפריקה: צפו בפרומו לעונה החדשה של הריאליטי האהוב,339,21/08/2025 16:39
רעי שני,1080648,בגלל אייל ברקוביץ': העיתונאים הוותיקים עוזבים במפתיע את עבודתם,3218,21/08/2025 16:31
יהודה לוינגר,1080649,"נגיד בנק ישראל נפרד: מגיב לראשונה לעזיבת המנכ""לית שולמית גרי",340,21/08/2025 16:28
אפרת קרסנר,1080644,נועה קירל חושפת סודות מהסמארטפון: איך היא קוראת לדניאל פרץ בטלפון?,549,21/08/2025 16:26
ענת סימן טוב,1080647,מקדונלד'ס מוזילה מחירים: שינוי באסטרטגיית התמחור,656,21/08/2025 16:19
אפרת בבג'ני,1080643,"אלי אלבג סוגר חשבון עם ינון מגל: ""אדבר איתו, אני חזק מזה""",387,21/08/2025 16:04
ירון שמאי,1080645,"גל עזיבות בבנק ישראל: המנכ""לית הודיעה על סיום תפקידה",697,21/08/2025 16:00
רעי שני,1080641,"ביטוח ישיר שוברת שיאים: הרווח זינק בכמעט 100%, תחלק דיבידנד ענק",295,21/08/2025 15:59
אפרת קרסנר,1080640,אחרי טרנטולה: סטטיק ואגם בוחבוט ישתפו פעולה בלהיט ענק נוסף,473,21/08/2025 15:57
רפאל בן זקרי,1080616, פרשו מהרווארד וגייסו מיליון דולר: המשקפיים החכמים שמתעדים כל שיחה,369,21/08/2025 15:50
כפיר אדר,1080544,בלגן בשידור בחדשות 12: ''השווית את עצמך לערבי עכשיו?'',597,21/08/2025 15:48
רעי שני,1080639,לקוחות וולט בישראל יוצאים למלחמה: יגישו תביעה ב-54 מיליון שקל?,978,21/08/2025 15:48
אפרת בבג'ני,1080637,ריבית בנק ישראל תופחת במהלך שנת 2025? זו התחזית המפתיעה,471,21/08/2025 15:38
רעי שני,1080636,"הקריפטו היומי: הביטקוין צולל, זה המטבע שזינק אחרי שהתרסק ב-10%",376,21/08/2025 15:34
רעי שני,1080635,צביקה הדר נפרד אחרי שנתיים בלבד: זו התוכנית אותה יפסיק להגיש,920,21/08/2025 15:21
אפרת בבג'ני,1080632,"רני רהב פורץ בבכי באמצע השידור: ""הוא חטף התקף לב ומת""",1563,21/08/2025 15:08
רוי שיינמן,1080573,"מניית מגדל בשיא - והמנכ""ל מדבר: מה יקרה לרווח בהמשך?",1137,21/08/2025 15:05
יהודה לוינגר,1080631,בשורה קשה: השירות המטאורולוגי צופה -  כמויות הגשם השנה צפויות להיות נמוכות,0,21/08/2025 15:01
גיא מויאל,1080630,"""סולטיז"" מגיבים לראשונה: ""המשטרה אמרה לנו שזה כלא""",3208,21/08/2025 14:42
רעי שני,1080629,בשורה לתושבי חדרה: אחרי סאגה של שנים - פרויקט הענק יוצא לדרך,523,21/08/2025 14:36
יהודה לוינגר,1080627,"החסמים החדשים של היוצר בעולם שבו המכונה יודעת ""לכתוב""",455,21/08/2025 14:25
רעי שני,1080628,שי אביטל לא מתכוון לשתוק: מגיש תביעות במיליונים נגד המתלוננות,1416,21/08/2025 14:24
כפיר אדר,1080543,כוכב האח הגדול נשבר בדמעות: מה שבר אותו לגמרי?,729,21/08/2025 14:19
טל גורן,1080623,גולדמן זאקס צופה: שוק המטבעות היציבים יגיע לשווי של טריליוני דולרים,345,21/08/2025 14:07
גיא מויאל,1080626,"מעל 30 אלף איש בתור: הנהלת הקניון התנצלה, אירוע ""סולטיז"" הופסק",11738,21/08/2025 14:07
רעי שני,1080621,ארקיע מסתבכת בתביעה חדשה: תשלם לנוסעים פיצויים בכ-600 אלף שקל?,2887,21/08/2025 14:06
גיא מויאל,1080625,"אביו של כוכב נבחרת ישראל: ""באנגליה וספרד הטילו וטו כי הוא ישראלי""",363,21/08/2025 13:57
רעי שני,1080622,"בזכות עסקת ""מקורות"": קבוצת הנדל""ן מזנקת ב-154% בהכנסות",275,21/08/2025 13:54
צוף צימרינג,1080620,הקמפיין של דמות ה-AI הראשון בישראל נחשף | פרסום ראשון,389,21/08/2025 13:40
רעי שני,1080618,"זעם על הטיפול בפרשת המורה מפתח תקווה: ""פגעה מינית בקטינים""",821,21/08/2025 13:35
גיא מויאל,1080617,"המטרידן של עדי זריפי נעצר: טען כי מדובר ב""סיפור אהבה""",543,21/08/2025 13:34
כפיר אדר,1080529,הזוכה ב-8 מיליון שקל בלוטו חושפת: למה יספיק הכסף?,783,21/08/2025 13:24
צוף צימרינג,1080615,"ספיר אביסרור: ""אני לא עושה שעווה במפשעה""",410,21/08/2025 13:24
טל גורן,1080612,"רופאה ואחות זרקו תרופות של ""טבע"" לפח וחטפו: ""צריך לפטר אותן""",273,21/08/2025 13:17
רעי שני,1080614,אזרח ישראלי היה עצור במשך שנה בכלא הלבנוני: כך הוא חזר,438,21/08/2025 13:14
רפאל בן זקרי,1080613, אפל בצרות: מי מנסה לעצור את מכירת השעון החכם?,405,21/08/2025 13:09
רעי שני,1080610,"כוכב ""האח הגדול"" עבר תאונת דרכים הזויה: ""זה כבר לצעוק אני מפגר""",393,21/08/2025 13:07
יהודה לוינגר,1080597,"הטייקון הישראלי שהעסיק אלפי עובדים הופך לסטנדאפיסט: ""הגעתי לפת לחם""",9670,21/08/2025 13:01
אפרת קרסנר,1080609,"כתבת ערוץ 14 חוגגת עם הקולגה: ""אוהבת אותך אהבת אמת""",378,21/08/2025 12:57
גיא מויאל,1080611,הראל ויזל משתלט על הענקית הגלובלית: הסכומים נחשפים לראשונה,875,21/08/2025 12:57
רעי שני,1080608,מס מלפני 30 שנה נגבה מאלפי ישראלים: חשבונות הבנק שלכם יעוקלו?,593,21/08/2025 12:51
טל גורן,1080607,עיריית חיפה למען הלוחמים: אלה ההופעות אליהם יוכלו להיכנס בחינם,182,21/08/2025 12:46
רוי שיינמן,1080013,קבוצות הכדורגל באירופה מכניסות מיליארדים - והמשקיעים בדרך,299,21/08/2025 12:43
רעי שני,1080606,מחדל כבד במטבח בישראל: עשרות חיילים לוקים בשלשולים והקאות  ,481,21/08/2025 12:36
גיא מויאל,1080604,"משפחות החטופים לבכירי צה""ל: ""אל תבצעו את החלטת הממשלה""",153,21/08/2025 12:28
טל גורן,1080601,מטולה מתפתחת: זה מה שיקום על גבול לבנון,186,21/08/2025 12:27
רעי שני,1080603,משרד הבריאות באזהרה מדאיגה: מחלת הכלבת מתפשטת במהירות בישראל,316,21/08/2025 12:26
אפרת קרסנר,1080596,אחרי סערת הקליפ: אמילי קופר חוגגת בענק,325,21/08/2025 12:26
הדר הראל,1080598,"לפני שאתם אורזים: מדוע ביטוח נסיעות לחו""ל הוא הפריט החשוב ביותר במזוודה שלכם?",106,21/08/2025 12:22
רעי שני,1080595,"דייר ""האח הגדול"" מטריף את הרשת: האם מדובר בזמר מ' המסתערב?",1427,21/08/2025 12:19
רפאל בן זקרי,1080600, פתיחת שנת הלימודים מתקרבת: כך תמצאו מחשב נייד ב-500 שקלים,573,21/08/2025 12:15
גיא מויאל,1080599,"רום שמיר על נסרין קדרי: ""ציפיתי לחזור""",5276,21/08/2025 12:11
רוי שיינמן,1080593,ויקטורי ואייל רביד עם עלייה בהכנסות ברבעון. מה קרה לרווח?,317,21/08/2025 12:03
ענת סימן טוב,1080594, אל על בהודעה לנוסעים: זה מה שיקרה בקרוב  ,603,21/08/2025 11:58
רעי שני,1080592,אבל כבד בענף הנדל״ן בישראל: הקבלן המוביל הלך לעולמו בגיל 73,907,21/08/2025 11:52
רעי שני,1080562,"רמי לוי, ויקטורי או זול ובגדול: אותו מוצר, פער של 1,000% במחיר",774,21/08/2025 11:48
צוף צימרינג,1080590,"אופירה אסייג וחיים לוינסון מודיעים על הקאמבק ביחד: ""אנחנו חוזרים!""",550,21/08/2025 11:43
רוי שיינמן,1080582,"איתן יוחננוף עם עלייה של 10.7% בהכנסות, אבל מה קרה לרווח?",310,21/08/2025 11:43
אפרת קרסנר,1080591,אחרי 15 שנה: העורך הראשי של אתר הנוער המצליח עוזב את תפקידו ,481,21/08/2025 11:42
רעי שני,1080583,מגרש הכדורגל הפך לשדה קרב: הרוגים ועשרות פצועים בקטטה מחרידה,632,21/08/2025 11:35
טל גורן,1080589,"ברק סרי: ""נתניהו הוא ראש הממשלה הכושל בתולדות מדינת ישראל""",1989,21/08/2025 11:35
ענת סימן טוב,1080586,השבוע האחרון של אוגוסט: כך מחירי האטרקציות עלו בעשרות אחוזים,284,21/08/2025 11:27
כפיר אדר,1080545,ענקית התעופה תשנה את נתב''ג? החברות הישראליות יוצאות למלחמה,313,21/08/2025 11:25
גיא מויאל,1080588,בנו של עמוס לוזון חושף: פרטים חדשים על פרשת הסרטונים האינטימיים,4084,21/08/2025 11:23
רוי שיינמן,1080585,"אהרון פרנקל משתלט על אלוני חץ. האם הוא ידיח את המנכ""ל?",326,21/08/2025 11:21
טל גורן,1080584,"אב החטוף תוקף בחריפות את נתניהו: ""מתנהג כמו טרוריסט""",434,21/08/2025 11:16
אפרת קרסנר,1080575,20 שנה אחרי: רוני דואני בקאמבק טלוויזיוני ובתפקיד מפתיע,278,21/08/2025 11:12
טל גורן,1080580,"יאיר גולן בביקורת חריפה על הממשלה: ""הגרועה בתולדות המדינה""",430,21/08/2025 11:00
אפרת קרסנר,1080579,עדן חסון קוטף ג'וב חדש: זה הקמפיין שבו הוא צפוי לככב,543,21/08/2025 11:00
רעי שני,1080581,"הזמר המצליח בישראל חושף: ""ביטלו לי הופעות, הפסדתי מיליוני שקלים""",451,21/08/2025 10:59
צוף צימרינג,1080574,פוטין נשיא רוסיה בן ה-72 מפתיע: היה בזוגיות עם קטינה בת 17?,345,21/08/2025 10:58
גיא מויאל,1080578,מכבי תל אביב מתכוננת ליום שאחרי: החלוץ שהיה בעין הסערה מועמד,393,21/08/2025 10:51
רעי שני,1080577,"מענק של 18,500 שקל לחשבון הבנק: אלפי עובדים בישראל מרוויחים בענק",388,21/08/2025 10:49
טל גורן,1080571,כמה הוציא איתמר בן גביר על משלוחי וולט? המספרים נחשפים,1017,21/08/2025 10:46
רוי שיינמן,1080576,"מנכ""ל קרסו נדל""ן: ""פרויקט לא רווחי לבעלי המניות - לא יקרה""",468,21/08/2025 10:45
כפיר אדר,1080540,האקס המיליארדר של יעל שלביה מפתיע: יהפוך לתושב ישראל בגיל 39,14317,21/08/2025 10:44
גיא מויאל,1080572,מכבי חיפה רגע לפני פתיחת העונה: הסטייל הישן-חדש במועדון,274,21/08/2025 10:26
אפרת קרסנר,1080569,כאן 11 בהישג ענק: תוכנית הריאליטי החדשה שכבשה את הצופים,394,21/08/2025 10:22
רעי שני,1080568,הפשיעה בישראל משתוללת: תופתעו לגלות באיזו עיר השיעור הגדול בפער,643,21/08/2025 10:20
גיא מויאל,1080570,"ברק סרי יורד על ינון מגל: ""בעיקר למטה. חלש""",5241,21/08/2025 10:13
רוי שיינמן,1080567,רמי לוי מקפיץ את המניה הזו ב-12% - הנה הסיבה,395,21/08/2025 10:11
טל גורן,1080566,אינטר מיאמי הסתדרה ללא מסי? זה ההישג המרשים,312,21/08/2025 10:06
יונתן סידון,1080391,תיקון היסטורי שייקצר את משך הוצאת היתר הבנייה? אדריכלית רותי שרת מנתחת  ,3422,21/08/2025 09:59
רוי שיינמן,1080563,הרווח של הראל ויזל נחתך כמעט בחצי. מה פגע בתוצאות הרבעון?,296,21/08/2025 09:55
איציק יצחקי,1080370,"יצחק תשובה עוד לא נכנס לישראכרט, כמה כסף הוא כבר הרוויח?",1547,21/08/2025 09:54
רעי שני,1080560,"רמי לוי, יוחחנוף או ויקטורי: סקר המחירים הגדול חושף את האמת המרה",570,21/08/2025 09:48
גיא מויאל,1080564,"הפדיחה של הפרויקט של רביבו: ""אני מוצא את עצמי לבד""",280,21/08/2025 09:46
טל גורן,1080559,מנחת האח הגדול למען ילדים העולים לכיתה א': זו הפלטפורמה שהשיקה,493,21/08/2025 09:40
רפאל בן זקרי,1080561, מטא עוצרת את החגיגה: טירוף השכר שלה מגיע לסיומו?,441,21/08/2025 09:39
צוף צימרינג,1080557,"עדן חסון חוטף בשל נטייתו המינית - כי לא מייצג ""תרבות יהודית""",2049,21/08/2025 09:37
רוי שיינמן,1080556,מגדל פרסמה דוחות - מה קרה לרווח ברבעון?,318,21/08/2025 09:25
רעי שני,1080554,"רייטינג: האח הגדול בשליטה מוחלטת, מה קורה עם הפטריוטים וערוץ 14?",1971,21/08/2025 09:24
גיא מויאל,1080558,"תרצה כהן לשון: ""אנחנו לא מתאימים"" - זו הייתה תגובתו",553,21/08/2025 09:19
ענת סימן טוב,1080555, בשורה לנוסעים: זו חברת התעופה הענקית שחוזרת לישראל  ,3751,21/08/2025 09:07
רעי שני,1080552,אבישג סמברג בדרמה ענקית: פונתה לבית החולים רגע אחרי החתונה שלה,723,21/08/2025 08:57
טל גורן,1080550,מכה לתעשיות הביטחוניות הישראליות: זו התערוכה בה לא יוכלו להשתתף,318,21/08/2025 08:57
גיא מויאל,1080553,שיכון ובינוי צומחת: הכנסות רבעוניות של 2.4 מיליארד שקל,378,21/08/2025 08:52
רעי שני,1080549,"עובדי מיקרוסופט נגד ישראל: הקימו את ""כיכר פלסטין"" במשרדי החברה",319,21/08/2025 08:43
צוף צימרינג,1080547,"סידני סוויני על קמפיין ""אמריקן איגל"": ""כולן אהבו את הרעיון""",277,21/08/2025 08:38
גיא מויאל,1080548,מאיה בוסקילה חלק מההיסטוריה: הזמרת שלא קיימת תככב לצידה,302,21/08/2025 08:28
