שם,מספר כתבה,כותרת,צפיות,תאריך יצירה
איציק יצחקי,1083649,"המשפחה שמחזיקה ב-200 דירות: ""מחירי השכירות ימשיכו לעלות""  ",23632,21/09/2025 06:00
כפיר אדר,1084652,רגע הזוי ברשת 13: הפיצוץ שהפתיע את כולם היה בכוונה?,679,21/09/2025 05:24
כפיר אדר,1084651,מיכל ינאי נפרדת בצער: ''הספקנו חיבוק אחרון לא מזמן'',717,21/09/2025 05:13
כפיר אדר,1084650,רמי לוי בהודעה ללקוחות בישראל: זה מה שיקרה בסניפים ב-24.9,1172,21/09/2025 05:03
רויטל ונונו,1084649,בגיל 40: הזמרת המפורסמת מצפה לילד שני,515,21/09/2025 01:59
רויטל ונונו,1084648,"אברי גלעד: ""אני בדיכאון. קיוויתי לחיים בעולם אחר לבנות שלי""",463,21/09/2025 01:10
רויטל ונונו,1084647,"שני אדרי מאשימה: ""יובל זכה בזכותי. לא הגיע לו""",1140,20/09/2025 23:59
ירון שמאי,1084646,"מאי גולן מסתבכת: ""חשד שקיבלה מעטפות כסף מזומן ותכשיטים""",3395,20/09/2025 22:58
טל גורן,1084645,נטפליקס ודיסני יעזבו את ישראל? זו ההחלטה של שר התקשורת,710,20/09/2025 22:49
טל גורן,1084644,סאבלימינל והצל במחווה לצ'רלי קירק: צפו ברגע המרגש,341,20/09/2025 22:36
טל גורן,1084643,"שלמה קרעי משתלח בתאגיד: ""מסית נגד המדינה, נפעיל עליו סנקציות כלכליות""",477,20/09/2025 22:25
ירון שמאי,1084642,100 אלף דולר לוויזת עבודה: מה משמעות המהלך הדרמטי של טראמפ?,562,20/09/2025 22:23
טל גורן,1084641,"ח""כ מהליכוד הותקף: ""לא מפסיקים לחגוג בזמן שהמדינה קורסת""",670,20/09/2025 22:13
טל גורן,1084640,"עקב זיהום חיידקי: בית החולים רמב""ם בהודעה חריגה",386,20/09/2025 21:51
טל גורן,1084638,משפיעניות הרשת הגדולות בסליחות בכותל המערבי: אלה המפורסמות שהשתתפו,340,20/09/2025 21:40
ירון שמאי,1084637,"רוני מאנה: ""לא מבין הורים ששולחים את הילדים לעזה, עליהם לסרב""",563,20/09/2025 21:29
טל גורן,1084636,"היולדות החילוניות מופלות בבית חולים איכילוב? ""לא יקרה שוב""",429,20/09/2025 21:17
טל גורן,1084635,הלהקה שפרסמה מסרים אנטישמים חוטפת מכה כואבת: זו ההחלטה שהתקבלה,272,20/09/2025 20:56
טל גורן,1084634,ישראל תורחק מהמפעלים האירופיים? זו ההחלטה המסתמנת,866,20/09/2025 20:37
כפיר אדר,1084625,אבל כבד בעולם הפרסום: המעצב החשוב בישראל נפטר בגיל 90,1365,20/09/2025 20:24
ירון שמאי,1084633,ארקיע בדרך לכבוש את האוקיינוס: זה הצעד החשוב שקרה אתמול,1648,20/09/2025 20:14
טל גורן,1084632,"דנה אינטרנשיונל תוקפת: ""ערוץ של הסתה, מקווה שיום אחד יסגרו אותו""",4421,20/09/2025 20:07
טל גורן,1084631,דונלד טראמפ מטיל פצצה: זה מספר החטופים החיים המוחזקים בעזה,351,20/09/2025 19:56
ירון שמאי,1084621,דובי פרנסס חוגג: חברת הענק הישראלית בדרך לוול סטריט,1219,20/09/2025 19:44
טל גורן,1084630,דונלד טראמפ אישר: מכירת טיקטוק יוצאת לדרך,636,20/09/2025 19:39
כפיר אדר,1084629,כמעט מיליון צופים ו-32.5%: זה הרגע שמגנט אתכם למסך ב-2025,424,20/09/2025 19:29
כפיר אדר,1084627,מכה קשה למיליוני ישראלים לקראת החג: זה מה שיקרה למוצרים הבסיסיים,427,20/09/2025 19:25
הדר הראל,1084548,5 טיפים קטנים שישדרגו כל ארוחת חג ויורידו מכם את הלחץ,737,20/09/2025 19:17
אפרת בבג'ני,1084585,"הרייטינג השבועי: רשת 13 ניצחה את קשת 12, האח הגדול בהישג אדיר",523,20/09/2025 19:17
רוי שיינמן,1084492,"הריבית בארה""ב תמשיך לרדת - כך אתם יכולים להרוויח",695,20/09/2025 19:17
אפרת בבג'ני,1084581,"הקריפטו השבועי: מגמה חיובית בשוק, זה המטבע שצמח ביותר מ-8%",380,20/09/2025 19:17
רעי שני,1084611,"דירוג עשירי ישראל: אדלסון חוגגת עם כ-200 מיליון דולר, עידן עופר מזנק",1524,20/09/2025 19:17
ענת סימן טוב,1084620,מתקפת סייבר רחבה: שיבושים בשדות התעופה,327,20/09/2025 19:16
כפיר אדר,1084622,אבל כבד בתרבות הישראלית: השחקן אריה מוסקונה נפטר בגיל 78,422,20/09/2025 19:16
כפיר אדר,1084623,ביטוח לאומי בבשורה נהדרת: זה המענק שתזכו לקבל ב-9.10,1785,20/09/2025 19:16
כפיר אדר,1084624,קרפור עושה שינויים בסניפים בישראל: זה מה שיקרה מהערב,857,20/09/2025 19:16
כפיר אדר,1084626,מתקפת סייבר בשדות התעופה בעולם: גם ישראל עשויה להסתבך?,291,20/09/2025 19:16
כפיר אדר,1084619,עומרי כספי נחשף: מדוע סירב להצעה מפתה מקשת 12?,957,19/09/2025 18:18
כפיר אדר,1084617,קנסות חדשים לנהגים בישראל: בקרוב לא תוכלו לברוח יותר,3164,19/09/2025 18:06
כפיר אדר,1084618,בית חולים חדש ייבנה בישראל: זה המיקום המפתיע בו יוקם,3359,19/09/2025 18:05
כפיר אדר,1084616,אהוד ברק פספס? החברה שלו לשעבר השלימה עסקת ענק,1513,19/09/2025 18:03
כפיר אדר,1084615,"קשת 12, רשת 13 או ערוץ 14? זה הערוץ הפופולרי בישראל",1980,19/09/2025 17:31
כפיר אדר,1084614,עידן עופר מפנק את העובדים: זו המתנה המטורפת שיקבלו לחג,4985,19/09/2025 17:19
כפיר אדר,1084613,ויקטורי מודיעה על שינוי למיליוני לקוחות: ''שמחים לבשר לכם'',23195,19/09/2025 17:06
ענת סימן טוב,1084518,"בעלי מאפה נאמן: ""עוגת שוקולד היא מוצר בסיסי, לא לשלם יותר מ-50 שקל""",4133,19/09/2025 17:00
רעי שני,1084608,"דירוג עשירי העולם: מאסק ואליסון מאבדים מיליארדים, צוקרברג מזנק",2122,19/09/2025 14:53
אפרת בבג'ני,1084612,אסף גרניט בשיחה על השקעות: מה עשה השף בבורסה לניירות ערך?,1319,19/09/2025 14:45
אפרת בבג'ני,1084610,נחשף: זה מותג המזגנים הישראלי שהוכתר כנותן השירות הטוב ביותר,768,19/09/2025 14:28
אפרת בבג'ני,1084609,"מאיה קיי מעוררת סערה: ""למה לרקוד ככה ליד גבר בזוגיות?""",5256,19/09/2025 14:12
רעי שני,1084606,"אשת העסקים הישראלית: ""תקופה חשוכה, כל הכסף שלי הלך""",21755,19/09/2025 13:52
אפרת בבג'ני,1084607,זוועה ברמת גן: בן 54 סימם אישה תוך מעשה מגונה בדירתה,1182,19/09/2025 13:52
צוף צימרינג,1084054,"היוטיובר המצליח בישראל עידן תלם: ""אני משקיע את הכסף שלי בעסק"" ",586,19/09/2025 13:37
רעי שני,1084605,"מנכ""ל ביג חושף: ""בחודשיים הקרובים נפתח עוד שני מרכזים חדשים""",2294,19/09/2025 13:23
אפרת בבג'ני,1084604,סם אלטמן מוכר את אחוזת הפאר שלו בהוואי - זה סכום העתק שהוא מבקש,423,19/09/2025 13:20
יהודה לוינגר,1084601,מומחי הקריפטו: הזינוק של זוז פאוור - מהפכה בישראל או גימיק פיננסי?,1362,19/09/2025 13:16
רעי שני,1084603,רמי לוי וישראייר במחדל: לא תאמינו מה קרה בטיסה לישראל,1166,19/09/2025 12:57
אפרת בבג'ני,1084602,"יובל לוי חוזר בתשובה: ""קיבלתי ממנו את הברכה, נגמר טוב""",572,19/09/2025 12:52
רעי שני,1084596,"אייל שני עוקץ את רותי ברודו: ""זו לא המציאות, מה אני אעשה?""",485,19/09/2025 12:33
יהודה לוינגר,1084600,הטכניקה לפענח את הסודות של התורה ומה הקשר לפרשה?,286,19/09/2025 12:29
אפרת בבג'ני,1084598,שלום מיכאלשווילי וליאל אלי כובשים את המסך: דירוג הפרסומות הטובות,877,19/09/2025 12:22
רעי שני,1084584,"בנק דיסקונט בתחזית מפתיעה: ""הריבית תרד פעמיים עד סוף השנה""",500,19/09/2025 11:56
רעי שני,1084599,"מאי גולן יורה לכל הכיוונים: ""התעללות מכוונת, התקף חרדה ורעידות""",2285,19/09/2025 11:49
רעי שני,1084597,ריקול לגבינות האהובות: המוצרים שיורדים מיידית מהמדפים בישראל,724,19/09/2025 11:33
אפרת בבג'ני,1084595,ניר ברקת נחשף: ארוחה ב-30 אלף שקל והוצאות במיליונים,1290,19/09/2025 11:17
רעי שני,1084594,אחרי גידי גוב: השחקן המפורסם נתפס נוהג בשכרות אחרי מרדף ונעצר,2835,19/09/2025 11:13
רעי שני,1084588,החוף האהוב ביותר בתל אביב נסגר לרחצה: זו הסכנה החדשה שהתגלתה,2096,19/09/2025 10:57
אפרת בבג'ני,1084592,"בן כספית על נתניהו: ""המדינה כבר מזמן לא מעניינת אותו""",523,19/09/2025 10:42
רעי שני,1084593,גידי גוב הוא בכלל הקורבן | יריב אופנהיימר,8653,19/09/2025 10:42
כפיר אדר,1084577,"סקר מנדטים מטורף: איזנקוט מרסק את לפיד, נתניהו בצרות",694,19/09/2025 10:31
רעי שני,1084590,עסקת כאל יוצאת לדרך: איש העסקים והראל ישלמו כ-3.8 מיליארד שקל,588,19/09/2025 10:27
אפרת בבג'ני,1084591,"הקריפטו היומי: מגמה שלילית בשוק, מה קרה לביטקוין?",422,19/09/2025 10:17
רוי שיינמן,1084499,"איש שוק ההון שקובע: ""הריבית לא תרד החודש""",1013,19/09/2025 10:07
כפיר אדר,1084576,הולמס פלייס מחלקת מאות שקלים במתנה: מי זכאי לפיצוי מהרשת?,580,19/09/2025 10:03
אפרת בבג'ני,1084589,"עמית סגל חוטף משקמה ברסלר: ""הוא שוב מהנדס תודעה""",6876,19/09/2025 10:02
רעי שני,1084586,"רייטינג: קשת 12 משאירה אבק למתחרים, הפטריוטים וערוץ 14 בהישג",1302,19/09/2025 09:45
אפרת בבג'ני,1084587,זינוק של כ-15.5% בהיקף התרומות בישראל: זה הסכום הגבוה ביותר שנתרם,354,19/09/2025 09:35
רעי שני,1084583,גל גדות העניקה את הפרס: יובל רפאל זכתה להישג מרגש במיוחד,548,19/09/2025 08:45
אפרת בבג'ני,1084582,"נתניהו: ""הפעולה שינתה את המציאות, היה עלינו איום קיומי""",604,19/09/2025 08:45
רעי שני,1084580,"בנק חדש נפתח בישראל, יצחק תשובה בעסקת ענק והאינפלציה מזנקת",1453,19/09/2025 08:19
איציק יצחקי,1084300,"מחירי הנדל""ן יורדים: היכן נמכרו דירות במרכז ב-1.3 מיליון שקל?",1080,19/09/2025 08:00
אפרת בבג'ני,1084579,"חשד להרעלת מזון בבסיסי צה""ל: כ-60 חיילים סבלו מהקאות",668,19/09/2025 07:55
רעי שני,1084578,"אינטל טסה, אנבידיה זינקה: וול סטריט נסגרה בשיא כל הזמנים",522,19/09/2025 07:50
הדר הראל,1084544,מדענים בהלם: מחקר גילה מה באמת קורה מתחת לפני המים של ים המלח,1401,19/09/2025 07:24
הדר הראל,1084549,איך לשרוד את ארוחת החג: 5 דרכים להתמודד עם שיחות שלא רציתם,744,19/09/2025 07:23
כפיר אדר,1084575,פרויקט תגלית נרתם: זה מה שעשה יחד עם אגודת אפרת,314,19/09/2025 07:18
אפרת בבג'ני,1084559,טופ גאם בהשקעה של כ-60 מיליון דולר: ענקית תוספי התזונה נחשפת,502,19/09/2025 07:00
כפיר אדר,1084573,רמי לוי מבקש מהלקוחות: ''קנו רק מה שאתם צריכים'',3742,19/09/2025 07:00
כפיר אדר,1084574,אברי גלעד מזהיר: ''עכשיו רוצים להשתלט על הכל',811,19/09/2025 07:00
ענת סימן טוב,1084565,"משנה למנכ""ל טרמינל X: ""אנחנו נתחיל  למכור ריהוט""  ",641,19/09/2025 06:40
כפיר אדר,1084572,ביטוח לאומי בבשורה משמחת: המענק הזה יוקדם כבר ל-21.9,1044,19/09/2025 06:38
כפיר אדר,1084571,סקר מנדטים מטלטל: נתניהו מאבד שליטה והאופוזיציה בורחת,901,19/09/2025 06:33
ענת סימן טוב,1084533," רמי לוי, יוחננוף או ויקטורי? זו הרשת הזולה ביותר  ",452,19/09/2025 06:26
כפיר אדר,1084570,"חיים לוינסון תובע את איש העסקים המוכר: יקבל 100,000 שקל?",4764,19/09/2025 06:25
איציק יצחקי,1084346,האם שוק הדיור מתנדנד? הקבלנים הבכירים מדברים על הכל,577,19/09/2025 06:10
כפיר אדר,1084516,תחנת רכבת חדשה תוקם בישראל: זו העיר המפתיעה בה תבנה,56768,19/09/2025 06:10
כפיר אדר,1084517,"כניסת השבת, יציאת שבת ומה יהיה מזג האוויר? 19.9.2025",363,19/09/2025 06:10
צוף צימרינג,1084521,"השרה מירי רגב נגד קורין גמליאל: ""תאונות דרכים אינן עניין בידורי""",509,18/09/2025 23:05
ירון שמאי,1084569,"מחבר 'אבא עשיר אבא עני' חושף במה הוא לא משקיע: ""זה ללוזרים""",1708,18/09/2025 22:54
יהודה רוזן,1084568,"הדו""ח חושף: מכבי ומאוחדת מתחזקות, לאומית מתאזנת, כללית מקרטעת",427,18/09/2025 22:52
יהודה רוזן,1084567,בתוך יומיים: האיש שרכש מיליונים והותיר את מנורה מחוץ לתמונה,441,18/09/2025 22:40
ירון שמאי,1084566,גידי גוב בהופעה ראשונה אחרי הסערה: מה אמר לקהל על התאונה?,1840,18/09/2025 22:10
אפרת בבג'ני,1084564,סקר מנדטים חדש: איזנקוט ינצח את נתניהו? כך הוא ישיג 30 מנדטים,1869,18/09/2025 21:55
ירון שמאי,1084563,בהשקעת 4 מיליון שקל: רשת האופנה פותחת את הסניף ה-32 בישראל,476,18/09/2025 21:46
רוי שיינמן,1084372,אח של סם אלטמן בגיוס ענק לקרן שלו - זה הסכום שהשיג בשבוע,404,18/09/2025 21:15
אפרת בבג'ני,1084561,"רני רהב מזהיר: ""תהיה לעם ישראל בעיה קשה איתך""",4983,18/09/2025 21:04
צוף צימרינג,1084562,"שון יפישין מ""האח הגדול"" נצפה צמוד לבחורה חדשה בחייו | פפראצי",1071,18/09/2025 21:02
כפיר אדר,1084538,רכבת ישראל עושה שינוי בשעות הנסיעה: זה מה שיקרה מה-22.9,882,18/09/2025 20:47
צוף צימרינג,1084560,"השרה מירי רגב נגד קורין גמליאל: ""ציטוט"" | צפו",0,18/09/2025 20:42
כפיר אדר,1084485,פרידה עוזיאל מודה: ''החיים מאוד מתסכלים'',360,18/09/2025 20:01
כפיר אדר,1084510,הדוגמנית ששונאת את ישראל משלמת מחיר: מאושפזת בבית החולים,597,18/09/2025 19:55
אפרת בבג'ני,1084558,"מאיה בוסקילה: ""הרגשתי כעס, בא לי לבקש ממנו סליחה""",344,18/09/2025 19:44
כפיר אדר,1084540,"הלוואות חדשות ב-2% בלבד: מי יוכלו לקבל עד 40,000 שקל?",2417,18/09/2025 19:35
ירון שמאי,1084557,"הותר לפרסום: 4 לוחמי צה""ל נהרגו ברפיח מפיצוץ מטען",273,18/09/2025 19:24
רוי שיינמן,1084477,"""מניית שופרסל תזנק ב-38%"" - אלו הסיבות",1046,18/09/2025 19:13
אפרת בבג'ני,1084556,מיכפל טכנולוגיות השלימה הנפקת מניות ראשונה בבורסה: זה הסכום שגייסה,278,18/09/2025 18:59
ירון שמאי,1084555,"כטב""ם ששוגר מתימן פגע במלון באילת: שריפה פרצה במקום ",540,18/09/2025 18:51
אפרת בבג'ני,1084554,עומר אדם נפרד מ-50 אלף שקלים: לא תאמינו למי הועבר הכסף,2437,18/09/2025 18:39
צוף צימרינג,1084553,"שירלי לוי מגיבה לראשונה על מות אחותה שירן לוי: ""עולמי קרס""",1055,18/09/2025 18:36
יונתן סידון,1084550,מציאות חדשה בשטח: החוק שמנצח את הפרוטקשן,1158,18/09/2025 18:35
ירון שמאי,1084551,אובר בהשקעת ענק בישראל: זו החברה שתגרוף עשרות מיליוני דולרים,865,18/09/2025 18:29
אפרת בבג'ני,1084552,"סיכום המסחר בבורסה: מגמה חיובית, זו המניה שצמחה ביותר מ-13%",290,18/09/2025 18:22
כפיר אדר,1084520,מהלך מכאיב של Disney+: בכמה יתייקר מחיר המנוי?,425,18/09/2025 18:01
אפרת בבג'ני,1084547,"רוני מאנה: ""הליכוד הפך לבדיחה גדולה, פשוט בושה וכלימה""",1055,18/09/2025 17:44
צוף צימרינג,1084546,יעל שלביה ולאנס סטרול בדרך לזוגיות? זה הדייט שלהם,1735,18/09/2025 17:38
הדר הראל,1084545,מחקר חדש חושף: הטעות הנפוצה שאתם עושים בבוקר - ואיך היא עלולה לקצר לכם את החיים,0,18/09/2025 17:27
כפיר אדר,1084543,שופרסל באיום חריג: הסכם כרטיסי האשראי עם כאל יבוטל?,647,18/09/2025 17:22
צוף צימרינג,1084541,כאן 11 חוסכים 50 אלף שקל: זו התוכנית שתפסיד,328,18/09/2025 17:22
אפרת בבג'ני,1084542,"אייפון 17 נחת בישראל: זה הדגם שעליו תשלמו פחות מ-4,000 שקלים",2074,18/09/2025 17:14
כפיר אדר,1084537,רשות המסים חושפת את השיטה: כך נכנסים לארץ מוצרים אסורים,704,18/09/2025 16:55
כפיר אדר,1084539,,0,18/09/2025 16:49
אפרת בבג'ני,1084536,"דרמה בחקירת אמה של מאי גולן - ברחה מהשוטרים: ""רעדה בכל גופה""",856,18/09/2025 16:34
רוי שיינמן,1084535,אקזיט ענק - המניה שמזנקת ב-85% בוול סטריט והקשר לישראל,739,18/09/2025 16:31
צוף צימרינג,1084534,דנה אינטרנשיונל חושפת: האם תרצה להביא לעולם ילד טרנסג'נדר? ,418,18/09/2025 16:31
כפיר אדר,1084523,מכרז ביטוח הרכב הגדול בישראל: מי יבטח אתכם ב-2026?,427,18/09/2025 16:21
ענת סימן טוב,1084528,רשת SPAR ממשיכה להתרחב: זה הסניף הרביעי שייפתח  ,9658,18/09/2025 16:13
צוף צימרינג,1084530,מתי כספי לפני גילוי המחלה: זה הפרויקט שעשה,596,18/09/2025 16:04
אפרת בבג'ני,1084532,"דרמה בשידור חי: זוכת תחרות היופי הוחרמה ע""י 27 מתמודדות",864,18/09/2025 16:04
כפיר אדר,1084505,המחסור בעוף הוא שקר? האמת על המחירים והאיומים נחשפת,441,18/09/2025 16:01
הדר הראל,1084527,"מגייסת 120 מיליון דולר כדי להחיות את החיה הזו - ""סיכון מוסרי אדיר""",309,18/09/2025 15:57
צוף צימרינג,1084531,,0,18/09/2025 15:53
צוף צימרינג,1084519,"כוכב ""נינג'ה ישראל"" ובת זוגו כבר לא | פרסום ראשון",612,18/09/2025 15:46
אפרת בבג'ני,1084526,פרויקט הפינוי בינוי בירושלים יוצא לדרך: כמה דירות חדשות ייבנו?,434,18/09/2025 15:33
אפרת בבג'ני,1084524,"הקריפטו היומי: מגמה חיובית בשוק, זה המטבע שצמח ביותר מ-5%",341,18/09/2025 15:20
כפיר אדר,1084525,נחמה והצלה במהלך מרגש: זו התרומה לזכר הזוג שנרצח בנובה,268,18/09/2025 15:19
ירון שמאי,1084522,תופת במעבר אלנבי: שני גברים נרצחו - זו זהות המחבל,258,18/09/2025 15:12
כפיר אדר,1084487,"מגיש רשת 13 נרדם באולפן: ''שבוע קשה, אל תשפטו''",966,18/09/2025 15:00
כפיר אדר,1084513,"כ-10,000 תושבים ו-2550 דירות בדרך: העיר הזו תעבור מהפכה",2143,18/09/2025 14:35
צוף צימרינג,1084515,אביב אלוש בדרמה: נפרד לאחר 12 שנה,789,18/09/2025 14:35
טל גורן,1084514,"נתניהו חושף: זו הסיבה שקרא למתקפה באיראן ""עם כלביא""",260,18/09/2025 14:34
רוי שיינמן,1084512,רעידת אדמה באינטל אחרי עסקה חסרת תקדים: המניה טסה ב-30%,1642,18/09/2025 14:26
הדר הראל,1084496,מדינה אוטוקרטית: מה זה אומר? וכיצד שלטון ריכוזי משפיע על הכלכלה,391,18/09/2025 14:21
יהודה לוינגר,1084506,אבי גבאי ופרטנר במהלך מסקרן: זו ההצעה לרכישה בהוט,609,18/09/2025 14:03
יונתן סידון,1084391,סופר מרקטינג: הכירו את ליאת אלקבץ – מנהלת השיווק של קבוצת נגב,834,18/09/2025 13:58
טל גורן,1084507,ישראל תאבד את בת בריתה הקרובה? זו ההחלטה שהתקבלה,518,18/09/2025 13:58
כפיר אדר,1084509,הונאת ענק בביטוח לאומי: כך עובדת השיטה שגוזלת מיליונים מהזכאים,1459,18/09/2025 13:58
כפיר אדר,1084470,שני אדרי מצהירה: ''אני צריכה את הכסף'',8259,18/09/2025 13:48
כפיר אדר,1084504,בלגן בפניקס: העובדים נגד האפליקצייה שתבדוק נוכחות,473,18/09/2025 13:44
ענת סימן טוב,1084503,"רמי לוי, אושר עד או ויקטורי: זו הרשת שהוזילה הכי הרבה את סל המזון שלה",514,18/09/2025 13:38
רוי שיינמן,1084500,"ענקית הנדל""ן חוזרת לבורסה - זה הסכום שגייסה",335,18/09/2025 13:35
טל גורן,1084502,הקמת המשכן לאומנויות הבמה הגדול בצפון יצאה לדרך: זו העיר שתרוויח,375,18/09/2025 13:27
כפיר אדר,1084501,רמי לוי פותר את הבעיה? כך לא יעבדו עליכם עם המחירים,727,18/09/2025 13:10
טל גורן,1084498,הממשלה ממשיכה להרוס את הרפורמה בסלולאר | פרופ' ירון זליכה,844,18/09/2025 13:08
איציק יצחקי,1084471,הקבלנים עובדים על המדינה: ככה לא מורידים מחירים,600,18/09/2025 13:01
טל גורן,1084495,"מגיש חדשות 12 מתפוצץ: ""צריך אומץ לעמוד מול הביביזם""",6280,18/09/2025 12:52
צוף צימרינג,1084497,מאיה בוסקילה,0,18/09/2025 12:51
כפיר אדר,1084494,נסרין קדרי בצרות: 500 שקל קנס ו-4 נקודות או פסילה?,5688,18/09/2025 12:43
כפיר אדר,1084493,הולנדיה בעסקת ענק: זו החברה שרכשה בעשרות מיליוני שקלים,516,18/09/2025 12:35
צוף צימרינג,1084491,טל מורד חושף: זה הרומן שהיה לי עם כוכבת קשת 12,8674,18/09/2025 12:31
טל גורן,1084490,"יהודה שלזינגר לברק סרי: ""אין לך פריבילגיה להתגזען על מזרחים, אתה משתכנז""",1875,18/09/2025 12:24
ענת סימן טוב,1084482,המחסור בשמנת תנובה מחריף: רשתות המזון מדווחות -המדפים ריקים  ,411,18/09/2025 12:18
צוף צימרינג,1084489,"יובל לוי זוכה ""האח הגדול"" משקיע: זה הצעד העסקי הבא",5297,18/09/2025 12:16
טל גורן,1084484,"אב החטוף תוקף: ""אמרו לנו שבגלל הממשלה נאלצים לסכל את הילדים""",183,18/09/2025 12:08
צוף צימרינג,1084488,טל מורד ,0,18/09/2025 12:07
צוף צימרינג,1084473,"נתנאל דהאן ותהילה בריגה מ""האח הגדול"" מבלים יחד | צפו",808,18/09/2025 12:07
כפיר אדר,1084486,המתחרה של רמי לוי שובר את השוק: הטבת 100 דולר,831,18/09/2025 11:59
כפיר אדר,1084483,המסעדה האהובה בתל אביב נסגרת מיידית: זה מה שהתגלה בה,757,18/09/2025 11:42
טל גורן,1084481,התפתחות נוספת בפרשת מאי גולן: שני חשודים שוחררו למעצר בית,505,18/09/2025 11:39
רוי שיינמן,1084454,אחרי עלייה של 400% - הגוף ששם 70 מיליון שקל במניה הלוהטת של השנה,8303,18/09/2025 11:32
